Enddate,Name,Region,ID,Headline,Copyright
20240501,MaharashtraDayIN,EN-IN,1070524150,"Ticket to nostalgia","Maharashtra, Mumbai, Victoria Terminus railway station (© Tuul &amp; Bruno Morandi/Getty Images)"
20240502,CratersOfTheMoon,EN-IN,2412374583,"To the moon and back","Blue Dragon Lava Flow, Craters of the Moon National Monument, Idaho (© Alan Majchrowicz/Getty Images)"
20240503,SonoranSpring,EN-IN,9627232224,"Even the hottest places are cool!","Brittlebushes blooming in springtime, Sonoran Desert, Arizona (© Charles Harker/Getty Images)"
20240504,JediMonastery,EN-IN,0109731817,"May the Fourth be with you!","The ruins of an ancient monastery on the island of Skellig Michael, Ireland (© MNStudio/Getty Images)"
20240505,KeralaRiver,EN-IN,0661487977,"Beyond backwaters","Beautiful aerial view of Kerala (© ebin francis/Shutterstock)"
20240506,TheRoachesPeakDistrict,EN-IN,0923215557,"A peek into the Peak District","The Roaches, Peak District, England (© George W Johnson/Getty Images)"
20240507,LittleDuckling,EN-IN,1177865327,"Of yellow fluff and water stuff","A duckling swimming in a water meadow, Suffolk, England (© Nick Hurst/Getty Images)"
20240508,PortMarseille,EN-IN,3194394496,"海港景色","伊夫堡，马赛，法国 (© Sergii Figurnyi/Alamy)"
