Enddate,Name,Region,ID,Headline,Copyright
20240501,HawaiianLei,ES-ES,3282014146,"¡Aloha, el susurro del paraíso!","Guirnaldas de flores de lei hawaianas (© Jotika Pun/Shutterstock)"
20240502,MadridOpen,ES-ES,2650206128,"¡El pulso de Madrid está en cada volea!","Gran Vía y Edificio Metrópolis en Madrid, España (© RudyBalasko/Getty Images)"
20240503,SonoranSpring,ES-ES,2911846610,"¡Incluso los lugares más calurosos son geniales!","Arbustos quebradizos floreciendo en primavera, Desierto de Sonora, Arizona, EE.UU. (© Charles Harker/Getty Images)"
20240504,JediMonastery,ES-ES,3031274198,"¡Que la fuerza te acompañe!","Las ruinas de un antiguo monasterio en la isla de Skellig Michael, Irlanda (© MNStudio/Getty Images)"
20240505,GuanacoMother,ES-ES,1631881267,"Pastoreo y crianza","Hembra de guanaco y cría recién nacida en pastizal, provincia de La Pampa, Argentina (© Gabriel Rojo/Minden Pictures)"
20240506,RiverNekarHeidelberg,ES-ES,3292625362,"¡Un paseo que recordar!","Heidelberg a orillas del río Neckar, en Baden-Wurtemberg, Alemania (© Juergen Sack/Getty Images)"
20240507,LittleDuckling,ES-ES,9482906211,"Plumas amarillas con melodía","Un patito nadando en un estanque, Suffolk, Inglaterra (© Nick Hurst/Getty Images)"
20240508,PortMarseille,ES-ES,3194394496,"海港景色","伊夫堡，马赛，法国 (© Sergii Figurnyi/Alamy)"
20240509,EmirganPark,ES-ES,9914635788,"Tulipanes salvajes","Tulipanes en el parque Emirgan de Estambul, Turquía (© Ozbalci/Getty Images)"
20240510,MisoolRajaAmpat,ES-ES,0084451413,"¡Las islas te llaman!","Misool, Islas Raja Ampat, Indonesia (© Giordano Cipriani/Getty Images)"
20240511,GironaForest,ES-ES,1227964184,"¡Viaja tierra adentro!","Tossa de Mar, Girona, Cataluña, España (© Artur Debat/Moment/Getty Images)"
20240512,SanMiguelAllende,ES-ES,3153624819,"¡Salud por México!","San Miguel de Allende, Guanajuato, México (© Mint Images/Getty Images)"
20240513,NamibiaCanyon,ES-ES,0636008379,"Vista de ojo de pez","Cañón del río Fish, Namibia (© R. M. Nunes/Getty Images)"
20240514,CarlsbadNP,ES-ES,0756476646,"Danzando por las profundidades","Pasarela de acceso a la Gran Sala, Cavernas de Carlsbad, Nuevo México, EE.UU. (© Doug Meek/Getty Images)"
20240515,BlueCityIndia,ES-ES,0873677345,"Perdido en una tierra azul","La ciudad azul de Jodhpur, India (© cinoby/Getty Images)"
20240516,ParaglidingChampion,ES-ES,1439141263,"¡Viento en popa!","Campeonato de Europa de Parapente. Pegalajar, Jaén, España (© Jorgefontestad/Getty Images)"
20240517,TarangireElephants,ES-ES,3245528088,"¡Una familia encantadora!","Una familia de elefantes africanos en el Parque Nacional de Tarangire, Tanzania (© Vicki Jauron, Babylon and Beyond Photography/Getty Images)"
20240518,IronmanLanzarote,ES-ES,3524222384,"¡Una ruta volcánica!","Volcanes en el Parque Nacional De Timanfaya en Lanzarote, Islas Canarias, España (© Lukas Bischoff/Getty Images)"
20240519,VernazzaItaly,ES-ES,4215156011,"Donde la historia se encuentra con el mar","Pueblo de Vernazza, Cinque Terre, Liguria, Italia (© Roberto Moiola/Sysaworld/Getty Images)"
20240520,HoneycombBee,ES-ES,4459802642,"¡Lo he encontrado!","Abeja cuidando un panal (© Simun Ascic/Alamy)"
20240521,MalaysiaTea,ES-ES,4744673149,"¡Hoy es tu día, quiere-te!","Plantación de té de Cameron Highlands, Malasia (© alex cheong/Getty Images)"
20240522,SnowGumTasmania,ES-ES,5020122004,"Sumérgete en la diversidad","Eucalipto de nieve de Tasmania (Eucalyptus coccifera), Parque Nacional de Mount Field, Tasmania, Australia (© Ignacio Palacios/Getty Images)"
20240523,IndianStarTortoise,ES-ES,5156830934,"¡Con la casa a cuestas!","Tortuga estrellada de la India, Sri Lanka (© Robin Chittenden/Minden Pictures)"
20240524,OrdesaNationalPark,ES-ES,5285302452,"¡Hasta la cima y más allá!","Cañón de Añisclo, Parque nacional de Ordesa y Monte Perdido, Huesca, España (© Marisa Estivill/Shutterstock)"
20240525,CorpusChristiGranada,ES-ES,5471686703,"¡La ciudad que lo tiene todo!","Alhambra de Granada, España (© SCStock/iStock/Getty Images Plus)"
20240526,MethowWildflowers,ES-ES,5583730186,"Salvajes y libres","Balsamorhiza y lupinos, Valle de Methow, Cascadas del Norte, Washington, EE.UU. (© Alan Majchrowicz/Getty Images)"
20240527,SestriLevante,ES-ES,5697216326,"¡Vamos a dar un paseo en barco!","Baia del Silenzio en Sestri Levante, Liguria, Italia (© StevanZZ/Getty Images)"
20240528,MeteoraMonastery,ES-ES,5821145513,"En la cima del mundo","Monasterio de Roussanou, Meteora, Tesalia, Grecia (© Marius Roman/Getty Images)"
20240529,MullOtter,ES-ES,5925633999,"¡Vamos a jugar!","Nutrias europeas adolescentes, Loch Spelve, Isla de Mull, Escocia (© Neil Henderson/Alamy)"
20240530,Everglades90th,ES-ES,6056767360,"El poder de la naturaleza","Pinos elliotis en el Parque Nacional de los Everglades, Florida, EE.UU. (© Jonathan Gewirtz/Tandem Stills + Motion)"
20240531,YorkshireDalesNP,ES-ES,3243650071,"Un lugar verde y tranquilo","Gunnerside, Swaledale, Parque Nacional Yorkshire Dales, Reino Unido (© Derek Croucher/Alamy)"
20240601,PrideMonthSF,ES-ES,3579859678,"Orgullo sin prejuicio","Ayuntamiento de San Francisco iluminado con el arcoíris en honor al mes del Orgullo, California, EE.UU. (© Josh Edelson/AFP via Getty Images)"
20240602,MenRuz,ES-ES,3990544497,"Una luz en la noche","Faro de Ploumanac'h, Costas de Armor, Francia (© Christian Handl/Getty Images)"
20240603,CopenhagenBicycles,ES-ES,4229368591,"Vida sobre ruedas","Bicicletas en Copenhague, Dinamarca (© Alphotographic/Getty Images)"
20240604,ChestnutBeeEater,ES-ES,4472834413,"Aves radiantes","Abejaruco Cabecirrufo, Parque Nacional de Bardiya, Nepal (© PACO COMO/Shutterstock)"
20240605,MadagascarRiver,ES-ES,4680489964,"¡Viva la Tierra!","Parque nacional de Masoala, Madagascar (© Dennis van de Water/Shutterstock)"
20240606,TenerifeBluetrail,ES-ES,5009256833,"¡Hasta la cima, esa es la meta!","Parque Nacional del Teide, Tenerife, España (© Santiago Urquijo/Moment/Getty Images)"
20240607,HumpbackFamily,ES-ES,5806856103,"Olas de Esperanza","Familia de ballenas jorobadas, Dutch Harbor, Alaska (© Jude Newkirk/Amazing Aerial Agency)"
