Enddate,Name,Region,ID,Headline,Copyright
20241005,ElephantTeacher,FR-FR,9412681522,"Les bâtisseurs de l'avenir","Éléphants d'Afrique dans le parc national de Tsavo East, Kenya (© Neil Bowman/Minden Pictures)"
20241006,CoyoteGulch,FR-FR,9860829479,"Sentier mythique au cœur du Glen Canyon","Peuplier deltoïdes, sentier de Coyote Gulch, Glen Canyon Recreation Area, Utah, États-Unis (© Stephen Matera/Tandem Stills + Motion)"
20241007,ElbePhilharmonic,FR-FR,0231525332,"Construisons demain !","Philharmonie de l'Elbe, Hambourg, Allemagne (© Canetti/Shutterstock)"
20241008,MototiOctopus,FR-FR,0598222042,"Poulpe fiction","Amphioctopus, Lembeh Strait, Indonésie (© Howard Chew/Alamy)"
20241009,AspensColorado,FR-FR,2017267378,"Le Colorado haut en couleur","Peuplier tremble près de Marble, Colorado, États-Unis (© Jason Hatfield/Tandem Stills + Motion)"
20241010,SoranoItaly,FR-FR,2493523171,"Échappée médiévale en Toscane","Sorano, Toscane, Italie (© Luigi Vaccarella/eStock Photo)"
20241011,CelticColours,FR-FR,3939645346,"Les Celtes à l'honneur","Hautes-Terres-du-Cap-Breton, Nouvelle-Écosse, Canada (© Cavan Images/Alamy)"
20241012,QuebecDuck,FR-FR,4323551846,"Le cousin d’Amérique","Canard branchu, Québec, Canada (© Maxime Riendeau/Getty Images)"
20241013,AlcazarSeville,FR-FR,4993322229,"Séville dans toute sa splendeur","Patio de las Doncellas, Alcazar de Séville, Espagne (© Danny Lehman/Getty Images)"
20241014,MarigotBay,FR-FR,5579307214,"Un cadre idylique","Bateaux dans la baie de Marigot, Terre-de-Haut, archipel des Saintes, Guadeloupe (© Tan Yilmaz/Getty Images)"
20241015,MaraMigration,FR-FR,6009612679,"L’odyssée des gnous","Grande migration des gnous à la rivière Mara, Kenya (© Ayzenstayn/Getty Images)"
20241016,FossilsDorset,FR-FR,6425876617,"Dévoiler le passé","Fossiles de bélemnites et d'ammonites, côte jurassique, Dorset, Royaume-Uni (© Nature Picture Library/Alamy)"
20241017,PitonFournaise,FR-FR,7028055947,"Connaissez-vous la Diagonale des Fous ?","Volcan Formica Leo, Piton de la Fournaise, île de La Réunion (© Stefan Kiefer/imageBROKER.com GmbH &amp; Co. KG/Alamy Stock Photo)"
20241018,CentralParkAutumn,FR-FR,2757358246,"邂逅秋日的林荫道","曼哈顿中央公园的秋天，纽约，美国 (© mapman/Shutterstock)"
20241019,DenderaTemple,FR-FR,5972566058,"Dévoiler la grandeur du passé","Temple d'Hathor, complexe du temple de Dendera, Qena, Égypte (© Nick Brundle Photography/Getty Images)"
20241020,NuitsChampagne,FR-FR,1213854382,"Mélodies au cœur des vignes","Vignobles de Champagne, parc naturel régional de la Montagne de Reims, Verzenay (© Philippe Turpin/Getty Images)"
20241021,AutumnCypress,FR-FR,1425004503,"Majesté d'automne","Cyprès chauves dans le parc d'État George L. Smith, Géorgie, États-Unis (© Chris Moore/TANDEM Stills + Motion)"
20241022,MonsterDoor,FR-FR,1619086814,"Une porte « monstrueuse »","Palais Zuccari, Rome, Italie (© Photon-Photos/Getty Images)"
20241023,MadameSherriCastle,FR-FR,1984816895,"Un escalier vers nulle part","Forêt de Madame Sherri et vestiges d'un ancien château, New Hampshire, États-Unis (© yggdrasill/Shutterstock)"
20241024,BodieCalifornia,FR-FR,2619483775,"Les fantômes de la Ruée vers l'or","Bodie State Historic Park, Mono County, Californie, États-Unis (© Julien McRoberts/Tetra Images, LLC/Alamy)"
20241025,MontBlancMassif,FR-FR,3086355782,"Quand Frankenstein rencontre les cimes du Mont-Blanc","Massif du Mont-Blanc, Chamonix (© Simon Schöpf/Getty Images)"
20241026,DaylightOrsay,FR-FR,6504936679,"Il est l’heure du changement d’heure !","Vue de Paris à travers l'horloge géante du Musée d'Orsay, Paris (© Bruce Beck/Alamy Stock Photo)"
20241027,PolarBearHug,FR-FR,4269390170,"Rien ne vaut un gros câlin !","Ourse polaire avec son ourson, Churchill, Manitoba, Canada (© Design Pics/plainpicture)"
20241028,PumpkinMist,FR-FR,4008635206,"L’automne en citrouilles à Victoria","Champ de citrouilles, Victoria, Colombie-Britannique, Canada (© Shaun Cunningham/Alamy)"
20241029,GreatOwl,FR-FR,5138937408,"L'esprit de la forêt","Grand-duc d’Amérique (© Mark Newman/Getty Images)"
20241030,HauntedEdinburgh,FR-FR,5789637805,"Une histoire qui hante","Vue du château d'Édimbourg depuis un cimetière en Écosse, Royaume-Uni (© Chris Dorney/Alamy)"
20241031,GargoyleParis,FR-FR,6298643080,"Frissons garantis !","Chimères de la cathédrale Notre-Dame de Paris (© scaliger/Getty Images)"
20241101,VineyardsBlackForestFall,FR-FR,4606412994,"Les vignobles de la Forêt-Noire","Vue aérienne de vignobles en automne, Varnhalt, Forêt-Noire, Allemagne (© Sabine Gerold/Amazing Aerial Agency)"
20241102,BisonYellowstone,FR-FR,6975480201,"Une icône américaine","Bison d’Amérique, parc national de Yellowstone, Wyoming, États-Unis (© Ian Shive/TANDEM Stills + Motion)"
20241103,YucatanBiosphere,FR-FR,6083251753,"Quand la nature rencontre le développement durable","Œufs de flamants roses des Caraïbes dans leur nid, Réserve de biosphère de Ría Lagartos, Yucatán, Mexique (© Claudio Contreras/Minden Pictures)"
20241104,CumbriaAutumn,FR-FR,6304384185,"Harmonie automnale au pied des collines","Grasmere, Lake District, Cumbria, Angleterre (© Thomas Molyneux/Getty Images)"
20241105,YucatanFlamingos,FR-FR,7541144444,"La flamboyance en vol","Flamants des Caraïbes, péninsule du Yucatán, Mexique (© Claudio Contreras/NPL/Minden Pictures)"
20241106,ShiShiBeach,FR-FR,6500831097,"Quand la nature s’endort","Shi Shi Beach, Parc national Olympique, Washington, États-Unis (© T.M. Schultze/TANDEM Stills + Motion)"
20241107,CanadaWolves,FR-FR,6675938333,"Une espèce de loup unique","Loups côtiers de l’île de Vancouver,  forêt pluviale du Grand Ours, Colombie-Britannique, Canada (© Nick Garbutt/Alamy)"
20241108,GlacialRivers,FR-FR,7112624449,"De la terre de feu et de glace","Vue aérienne de rivières glacières, Islande (© rybarmarekk/Shutterstock)"
20241109,MoroccoMilkyWay,FR-FR,7350408140,"En route vers les étoiles","Voie lactée, Aït Benhaddou, Maroc (© Cavan Images/Getty Images)"
20241110,VendeeGlobe,FR-FR,8019139667,"La flamboyance en vol","Les Sables-d'Olonne, la Tour d'Arundel, le casino, le fort Saint-Nicolas et le chenal menant au port (© Leroy Francis/Hemis/Alamy Stock Photo)"
20241111,Banff24,FR-FR,8236269164,"Au cœur des Rocheuses canadiennes","Parc national de Banff, Alberta, Canada (© fywPhoto 云卷云舒/Getty Images)"
20241112,Moorea,FR-FR,8377929183,"Le lagon enchanté de Moorea","Coraux et lagon de Moorea, Polynésie française (© bru_greg/Getty Images)"
20241113,KelpForest,FR-FR,8537337820,"Le roi lion des mers","Lion de mer dans une forêt de varech géant, Basse-Californie, Mexique (© Claudio Contreras/Minden Pictures)"
20241114,ManarolaItaly,FR-FR,8734568638,"Un voyage au fil des côtes","Manarola, Parc national des Cinque Terre, Ligurie, Italie (© John_Silver/Shutterstock)"
20241115,YiPengLanterns,FR-FR,2863208745,"Quand l'espoir prend son envol","Festival des lanternes de Yi Peng, Chiang Mai, Thaïlande (© tampatra/Getty Images)"
20241116,FrieslandNetherlands,FR-FR,3199784151,"Le ciel, la mer et de la vase !","Le littoral de la mer des Wadden, Frise, Pays-Bas (© Ron ter Burg/Minden Pictures)"
20241117,RedStag,FR-FR,3460398465,"Le maître de ces bois","Cerf élaphe dans la forêt calédonienne, Glen Affric, Highlands, Écosse (© Terry Whittaker/Alamy)"
20241118,PorthcawlLighthouse,FR-FR,3687906997,"Le gardien des mers galloises","Phare de Porthcawl, Pays de Galles, Royaume-Uni (© Leighton Collins/Alamy)"
20241119,TasmansArch,FR-FR,3887612340,"Une arche « diabolique »","Arche de Tasmans Tasmanie, Australie (© Gary Bell/Minden Pictures)"
20241120,BeyondSaype,FR-FR,1795905140,"Un avenir à protéger, un présent à respecter","Fresque géante « Beyond Crisis » de Saype, Leysin, Suisse (© VALENTIN FLAURAUD/EPA-EFE/Shutterstock)"
20241121,LionCubs,FR-FR,2539679303,"Les jeunes rois de la savane","Lionceaux au lever du soleil, Afrique du Sud (© Ruan Springorum/Getty Images)"
20241122,ZafraCastle,FR-FR,2717876307,"Une fortification dans l'univers d'une série emblématique","Château de Zafra, Guadalajara, Espagne (© Eduard Gene/Getty Images)"
20241123,FibonacciAloe,FR-FR,2896003531,"Le code secret de la nature","Aloès en spirale, île Kangaroo, Australie (© Michael Melford/Alamy)"
20241124,ParisAutumn,FR-FR,3278291664,"Découvrez les secrets de Paris en automne","Paris aux couleurs de l’automne (© encrier/Getty Images)"
20241125,AmboseliGiraffes,FR-FR,8363811171,"La vie sauvage dans toute sa splendeur","Girafes Masai, parc national d'Amboseli, Kenya (© Art Wolfe/DanitaDelimont.com)"
20241126,TrulliGrove,FR-FR,3683617209,"Le symbole de paix et de la vie","Oliveraie, vallée d'Itria, Pouilles, Italie (© Massimo Santi/Shutterstock)"
20241127,RaidAlyzees,FR-FR,4119370811,"Une aventure solidaire 100% féminine","Baie du Marin, Martinique (© Tuul &amp; Bruno Morandi/Getty Images)"
20241128,SemoisRiver,FR-FR,4323889306,"L'endroit où repose le géant","Tombeau des Géants en automne, Bouillon, Belgique (© David Briard/Getty)"
20241129,MtStMichel,FR-FR,7113909915,"Un site unique et intemporel","Mont Saint-Michel, Normandie (© Captain Skyhigh/Getty Images)"
20241130,KilchurnAutumn,FR-FR,7304840775,"Sortez vos kilts !","Reflet du château de Kilchurn à Loch Awe, Argyll et Bute, Écosse (© Tom Mackie/plainpicture)"
20241201,IcebergsAntarctica,FR-FR,7491065799,"Protéger les dernières grandes étendues sauvages","Icebergs, Antarctique (© Art Wolfe/DanitaDelimont.com)"
20241202,SnowMoose,FR-FR,5886438114,"Prenez votre « élan » vers le Grand Nord","Femelle élan, parc national de Denali, Alaska, États-Unis (© Cavan Images/Alamy)"
20241203,JaipurFort,FR-FR,7682390069,"Des piliers et des hommes","Sattais Katcheri, Fort d'Amber, Amer, Jaipur, Rajasthan, Inde (© Yury Taranik/Shutterstock)"
20241204,RhinosKenya,FR-FR,8206885022,"Un animal au bord de l'extinction","Rhinocéros blancs mâles, lac Nakuru, Kenya (© Ingo Arndt/Minden Pictures)"
20241205,MonoTufa,FR-FR,7760480527,"Un trésor géologique californien","Cheminées de fées sur le lac Mono, Californie, États-Unis (© Susanna Patras/TANDEM Stills + Motion)"
20241206,ColmarHoliday,FR-FR,1755218249,"Magie Hivernale","Maisons traditionnelles alsaciennes à colombages et rivière Lauch Colmar, Alsace (© KavalenkavaVolha/Getty Images)"
20241207,ArraialdoCabo,FR-FR,2062864559,"Du bleu à perte de vue","Arraial do Cabo dans l'État de Rio de Janeiro, Brésil (© Derson Santana/Shutterstock)"
20241208,ReopeningNotreDame,FR-FR,5165801809,"Notre-Dame renaît de ses cendres","Cathédral Notre-Dame de Paris (© Julien Fromentin/Getty Images)"
20241209,GuanacosChile,FR-FR,0722338222,"Les gardiens des steppes andines","Guanacos, parc national Torres del Paine, Chili (© Floris van Breugel/NPL/Minden Pictures)"
20241210,CornwallSnow,FR-FR,1834119825,"Le Finisterre anglais","Le sentier côtier de Cornouailles recouvert de neige, Land's End, Cornouailles, Angleterre (© Josef FitzGerald-Patrick/Getty Images)"
20241211,DolomitesSky,FR-FR,2183933361,"Les géants des Dolomites italiennes","Tre Cime di Lavaredo, Italie (© Daniel Maran/Getty Images)"
20241212,WildPoinsettia,FR-FR,2758700807,"La fleur de Noël par excellence","Poinsettia ou Fleur de Noël (© David Hosking/NPL/Minden Pictures)"
20241213,ChristmasBudapest,FR-FR,0838567901,"Un avant-goût de Noël","Marché de Noël, basilique Saint-Étienne, Budapest, Hongrie (© Calin Stan/Shutterstock)"
20241214,LynxTree,FR-FR,1855644774,"Le sphinx des bois","Lynx de Boréal perché dans un arbre, France (© Marc Chesneau/Getty Images)"
20241215,MisurinaLake,FR-FR,7558311472,"Un lac de larmes","Lac Misurina, Dolomites, Italie (© Marco Bottigelli/Getty Images)"
20241216,SalzburgSnow,FR-FR,2498324626,"La perle des Alpes","Salzbourg, Autriche (© bluejayphoto/Getty Images)"
20241217,ReinefjordenNorway,FR-FR,9231276610,"Un paysage magique","Cabanes traditionnelles de pêcheurs sur le rivage de Reinefjorden, Norvège (© Pilat666/Getty Images)"
20241218,NutcrackerBallet,FR-FR,0747265079,"Le ballet incontournable de ces fêtes","Représentation de Casse-Noisette par l’English National Ballet (© Caroline Holden/Alamy Stock Photo)"
20241219,SibiuRomania,FR-FR,5904755818,"Noël au Cœur de la Transylvanie","Marché de Noël de Sibiu, Roumanie  (© Calin Stan/Alamy)"
20241220,SantaClausVillage,FR-FR,1605218480,"Là où vit le Père Noël","Village du Père Noël à Rovaniemi, Laponie, Finlande (© Smelov/Shutterstock)"
20241221,SolsticeHalo,FR-FR,4955312327,"Merveille hivernale","Halo autour du soleil, Monts Métallifères, Saxe, Allemagne (© Martin Ruegner/Getty Images)"
20241222,CrystalPier,FR-FR,4694395729,"Le surf, le sable et le Père Noël !","Arbre de Noël à Crystal Pier, Pacific Beach, San Diego, Californie (© SamAntonioPhotography/Getty Images)"
20241223,FestivusCranes,FR-FR,4485267796,"L'art du vol","Grues du Japon, Kushiro, Hokkaido, Japon (© Wirestock, Inc./Alamy)"
20241224,SantaSnowglobe,FR-FR,4108706539,"N’oubliez pas vos petits souliers !","Marché de Noël en Allemagne (© Cyril Gosselin/Getty Images)"
20241225,ReindeerTrio,FR-FR,3852495223,"Joyeux Noël !","Rennes du Svalbard, parc national de Van Mijenfjorden, Norvège (© Martin Zwick/REDA&amp;CO/Universal Images Group via Getty Images)"
20241226,PointeDiable,FR-FR,3649413809,"Le souffle du diable et de la nature","Pointe du Diable, Saint Pierre, Parc national de la Réunion (© MONTICO Lionel/Hemis/Alamy Stock Photo)"
20241227,LakeBledSnow,FR-FR,5167708906,"Des magnifiques reflets glacés","Lac de Bled, Slovénie (© Kesu01/Getty Images)"
20241228,CoralTurtle,FR-FR,9548465819,"La doyenne de nos océans","Tortue verte, océan Pacifique, Nouvelle-Calédonie (© Damsea/Shutterstock)"
20241229,BorobudurBells,FR-FR,9771454901,"La montagne sacrée","Temple de Borobudur, Java, Indonésie (© Robertharding/Shutterstock)"
20241230,MountFieldNP,FR-FR,0048358623,"Un parc extraordinaire","Eucalyptus coccifera et pandanus, parc national de Mount Field, Tasmanie, Australie (© Whitworth Images/Getty Images)"
20241231,ParisNewYearEve,FR-FR,3084713180,"Le compte à rebours est lancé !","Arc de Triomphe sous les feux d’artifice, Paris (© Kiran Ridley/Getty Images)"
20250101,PolarBearSwim,FR-FR,0276887378,"Bienvenue 2025 !","Ours polaires, Arctique (© Ondrej Prosicky/Shutterstock)"
20250102,AlpsSunset,FR-FR,0523137668,"Le trésor de l’Europe","Montagne enneigée au coucher du soleil, Alpes françaises (© raeva/Getty Images)"
20250103,TolkienOxford,FR-FR,1207092725,"Là où l’anneau est né","Radcliffe Camera et All Souls College, Université d'Oxford, Angleterre (© atiger/Shutterstock)"
20250104,VietnamFalls,FR-FR,1506770845,"Un paradis à la lisière de la frontière","Chutes de Ban Gioc, Vietnam (© Shane P. White/Minden Pictures)"
20250105,PlumParakeet,FR-FR,1766885015,"Une perruche qui compte pour des prunes !","Perruche à tête de prune, Shimoga, Karnataka, Inde (© Hira Punjabi/Alamy)"
20250106,RavennaBasilica,FR-FR,1984355211,"L'art à l'italienne","Crypte sous l’eau, Basilique Saint-François de Ravenne, Italie (© Andrea Pucci/Getty Images)"
20250107,BouldersNZ,FR-FR,2503535078,"Pierre qui roule….","Moeraki Boulders, Île du Sud, Nouvelle-Zélande (© Douglas Pearson/eStock Photo)"
20250108,GreatWallStairs,FR-FR,2831168051,"Il était une fois, la Grande Muraille","La Grande Muraille enneigée, Chine (© View Stock/Alamy)"
20250109,NamibiaDunes,FR-FR,3454752206,"Du sable à perte de vue","Dunes de Sossusvlei, désert du Namib, Namibie (© Airpano/Amazing Aerial Agency)"
20250110,DayTintin,FR-FR,0911497926,"Le plus célèbre des journalistes","Route de la bande dessinée, peinture murale de Tintin de Hergé à Bruxelles (© travelpix/Alamy Stock Photo)"
20250111,MeknesMorocco,FR-FR,1385030402,"Des arches d'un autre temps","Monument de Hri souani, Meknès, Maroc (© Calin Stan/Shutterstock)"
20250112,CrescentTail,FR-FR,1748387679,"Les yeux des abysses","Poisson Gros-Yeux, Grande Barrière de Corail, Australie (© Fred Bavendam/Minden Pictures)"
20250113,CoastalWales,FR-FR,2215820217,"Un nouvel an retardataire","Cottage et phare de Tŵr Mawr, Ynys Llanddwyn, Pays de Galles, Royaume-Uni (© Westend61 on Offset/Shutterstock)"
20250114,CadizSpain,FR-FR,2616000691,"Un véritable havre de paix","Zahara de la Sierra, Cadix, Espagne (© SEN LI/Getty Images)"
20250115,MuseumCourt,FR-FR,4239916080,"Là où le passé est toujours présent","Grande Cour Élisabeth II, British Museum, Londres, Angleterre (© Cavan Images/Offset/Shutterstock)"
20250116,PinnaclesPeaks,FR-FR,5164595445,"Merveilles volcaniques","Parc national des Pinnacles, comté de San Benito, Californie, États-Unis (© yhelfman/Getty Images)"
20250117,PelicanPortrait,FR-FR,5861205489,"Un pélican pas comme les autres","Pélican brun, San Diego, Californie, États-Unis (© Arthur Morris/BIRDS AS ART/Getty Images)"
20250118,WhiteSandsNP,FR-FR,0107552593,"Le désert mexicain","Coucher de soleil, parc national de White Sands, Nouveau Mexique, États-Unis (© Image Professionals GmbH/Alamy)"
20250119,NeptunesGrotto,FR-FR,0309930376,"Une grotte divine","Grotte de Neptune, Sardaigne, Italie (© Carlo Murenu/Getty Images)"
20250120,BubbleLake,FR-FR,0545944347,"Des bulles à perte de vue !","Lac Abraham, Alberta, Canada (© Basic Elements Photography/Getty Images)"
20250121,ColourfulBlueMonday,FR-FR,0873171314,"Dites non au Blue Monday !","Cabanes aux toits colorés recouvertes de neige à Gouville-sur-Mer, Normandie (© Andia/Getty Images)"
20250122,PetraMonastery,FR-FR,1072501086,"La plus belle des cités perdues","Ad-Deir, Pétra, Jordanie (© Punnawit Suwuttananun/Getty Images)"
20250123,DeerValley,FR-FR,5592642570,"Cinéma, montagnes et magie","Deer Valley au crépuscule, Park City, Utah, États-Unis (© Adventure_Photo/Getty Images)"
20250124,IcelandGeyser,FR-FR,6775594395,"La puissance en ébullition","Geyser Strokkur, Islande (© John and Tina Reid/Getty Images)"
20250125,PortoSunset,FR-FR,7243507947,"L'heure dorée à Porto","Porto, Portugal (© Starcevic/Getty Images)"
20250126,FrostedBeech,FR-FR,8535589917,"Vieillir avec grâce","Forêt de hêtres, Belgique (© Philippe Moes/Minden Pictures)"
20250127,ParisSnow,FR-FR,5265906192,"Flocons sur la Ville Lumière","La tour Eiffel sous la neige, Paris (© Orbon Alija/Getty Images)"
20250128,FlyingOwl,FR-FR,1750905079,"Un chasseur hors pair","Hibou des marais chassant sous une neige épaisse (© Dilshan Muthalib/Getty Images)"
20250129,LunarDragon,FR-FR,2196981779,"Une année de sagesse et renouveau","Danse du dragon, Wuhan, Chine (© Miao Jian/Wuhan Morning Post/Visual China Group via Getty Images)"
20250130,OrdesaSpain,FR-FR,2730396570,"Être toujours sur la brèche !","Brèche de Roland, Parc national d'Ordesa et de Monte Perdido, Espagne (© Inaki Relanzon/Nature Picture Library/Alamy)"
20250131,PlainsZebra,FR-FR,3265795603,"Sortez vos plus beaux modèles à rayures !","Zèbres des plaines au lever du soleil, parc national de Mokala, Afrique du Sud (© EcoPrint/Shutterstock)"
20250201,DeerForest,FR-FR,6532705920,"La noblesse du cerf","Cerf élaphe, forêt de Rambouillet,  Île-de-France (© Nicolas Le Boulanger/500px/Getty Image)"
20250202,AustriaMarmot,FR-FR,4256858728,"Peu importe le temps","Marmotte des Alpes (© Jonas Fichtner-Pflaum/Getty Images)"
20250203,RibbleheadViaduct,FR-FR,4663739053,"Relier le passé, pierre par pierre","Viaduc de Ribblehead et sommet d’Ingleborough, Nord de l'Angleterre, Royaume-Uni (© AWL Images/DanitaDelimont.com)"
20250204,GoldenBridge,FR-FR,5137269465,"Une balade au-dessus des nuages","Pont doré, collines Bà Nà, Da Nang, Vietnam (© Hien Phung Thu/Shutterstock)"
20250205,ScottishSheep,FR-FR,6098426442,"Des bêêh-liers pas comme les autres","Moutons Scottish Blackface, Écosse (© Mike Powles/Getty Images)"
20250206,WhararikiBeach,FR-FR,6142596123,"Reflets d'un héritage national","Îles Archway, plage de Wharariki, Tasman, Nouvelle-Zélande (© Francesco Vaninetti/AWL/plainpicture)"
20250207,LouvreRainyDay,FR-FR,9439129374,"Passé et présent en miroir","Pyramide du Louvre, Paris, France (© Andriy Kravchenko/Alamy Stock Photo)"
20250208,SnowySvaneti,FR-FR,5675454162,"Figé dans le temps","Tours médiévales, Mestia, Haut-Svaneti, Géorgie (© photoaliona/Getty Images)"
20250209,AlstromPoint,FR-FR,6504478404,"Un point de vue à ne pas perdre !","Alstrom Point, lac Powell, Utah, États-Unis (© T.M. Schultze/TANDEM Stills + Motion)"
20250210,UmbrellaDay,FR-FR,6755683409,"Un p’tit coin d’parapluie...","Installation artistique de parapluies, Borough Market, Londres, Angleterre (© Malcolm P Chapman/Getty Images)"
20250211,YungangGrottoes,FR-FR,6982379876,"Le regard attentif de l'Histoire","Grottes de Yungang, Datong, province de Shanxi, Chine (© Eric Yang/Getty Images)"
20250212,GalapagosIguana,FR-FR,7185960680,"La théorie de Darwin","Iguanes marins, îles Galápagos, Équateur (© helovi/Getty Images)"
20250213,LakeTyrrell,FR-FR,7385244492,"Le sel de la Terre","Lac Tyrrell, Victoria, Australie (© Monica Bertolazzi/Getty Images)"
20250214,PenguinLove,FR-FR,7793534409,"Regardez ces tourtereaux","Deux manchots de Magellan, îles Malouines (© Vicki Jauron, Babylon and Beyond Photography/Getty Images)"
20250215,CarnivalNice,FR-FR,8752947591,"C'est toute une parade !","Défilé du Carnaval de Nice, le Roi sur la Promenade des Anglais (© aerial-photos.com/Alamy Stock Photo)"
20250216,HumpbackMother,FR-FR,6742238424,"Protégeons les géants de l’océan","Baleine à bosse et son baleineau, Tonga (© Chase Dekker/Minden Pictures)"
20250217,Misotsuchi2025,FR-FR,1372228903,"Une beauté glaçante","Stalactites de Misotsuchi, Chichibu, Japon (© watayu0821/Shutterstock)"
20250218,BlueBelize,FR-FR,7135169329,"Le Grand Bleu","Le Grand Trou Bleu, Belize (© JamiesOnAMission/Shutterstock)"
20250219,IceHoleOtter,FR-FR,7480810536,"Je nage loutrement bien !","Loutre d'Europe, Lelystad, Pays-Bas (© Ernst Dirksen/Minden Pictures)"
20250220,BlueNorway,FR-FR,6545553571,"Bleu comme la Norvège","Heure bleue à Trondheim, Norvège (© Jeanny Mueller/Getty Images)"
20250221,MentonFestival,FR-FR,5996828688,"Si on vous donne des citrons...","Fête du citron, Menton, Alpes-Maritimes (© NelzTabcharani316/Shutterstock)"
20250222,ChampakaSarasi,FR-FR,2567169417,"Une histoire d’eau","Bassin de Champaka Sarasi, Karnataka, Inde (© Amith Nag Photography/Getty Images)hotography/Getty Images)"
20250223,MtFujiSunrise,FR-FR,3629705815,"L'appel du mont Fuji","Lever de soleil au mont Fuji, Lac Kawaguchi, Japon (© Twenty47studio/Getty Images)"
20250224,GiantCuttlefish,FR-FR,8590035625,"Des seiches archi seiches","Groupe de seiches géantes dans le golfe Spencer, au large de Whyalla, Australie-Méridionale (© Gary Bell/Minden Pictures)"
20250225,MillauBridge,FR-FR,5934709762,"Un géant dans les nuages","Viaduc de Millau, Aveyron, France (© Andrzej Gorzkowski Photography/Alamy Stock Photo)"
20250226,ArgyllStalker,FR-FR,0089551685,"Les mystères voilés du loch","Château de Stalker sur le loch Laich, Argyll, Écosse (© WLDavies/Getty Images)"
20250227,PolarCub,FR-FR,0353812683,"Boule de neige vivante","Ourson polaire, Churchill, Manitoba, Canada (© Eric Baccega/NPL/Minden Pictures)"
20250228,BhutanMonastery,FR-FR,1020195060,"Une sérénité ancrée dans la montagne","Monastère Taktshang, Bhoutan (© Baron Reznik/Getty Images)"
20250301,MaligneLakeJasper,FR-FR,2308232847,"Danse magique sur un lac mystique","Aurores boréales au-dessus de Spirit Island sur le lac Maligne, Parc national Jasper, Canada (© Mumemories/Getty Images)"
20250302,EucalyptusForest,FR-FR,3221720443,"Une vue eucalyp-tique","Eucalyptus, vallée de Megalong, parc national des Blue Mountains, Australie (© Andrew Peacock/TANDEM Stills + Motion)"
20250303,HornbillPair,FR-FR,3828518426,"Envol vers la vie sauvage","Calaos à bec jaune du sud dans le parc national Kruger, Afrique du Sud (© Richard Du Toit/Minden Pictures)"
20250304,MardiGrasJackson,FR-FR,5010820128,"Un mardi pas comme les autres","Jackson Square, Nouvelle-Orléans, Louisiane, États-Unis (© SeanPavonePhoto/Getty Images)"
20250305,SuratThani,FR-FR,5557578896,"En route pour l’aventure !","Vue aérienne du parc national de Khao Sok, Surat Thani, Thaïlande (© Peetatham Kongkapech/Getty Images)"
20250306,NevadaBigHorns,FR-FR,5758477568,"Symbiose sculptée dans la roche","Mouflon du désert dans le parc d'État Valley of Fire, Nevada, États-Unis (© Rachid Dahnoun/Cavan Images)"
20250307,PlumBlossom,FR-FR,5716375690,"Un symbole de résilience","Fleurs de prunier, Chine (© zhikun sun/Getty Images)"
20250308,FearlessWomen,FR-FR,5893935829,"Défier l’obscurité","Statue « Fearless Girl » face à Wall Street, New York, États-Unis (© JOHANNES EISELE/AFP via Getty Images)"
20250309,kingfisherFr,FR-FR,6370911716,"À la rencontre du pêcheur aux ailes de saphir","Martin-pêcheur d'Europe sur une branche (© Javier Fernández Sánchez/Getty Images)"
20250310,NappingLion,FR-FR,6791104694,"Dans la jungle, paisible jungle","Lion au repos, parc national Queen Elizabeth, Ouganda (© Gunter Nuyts/Getty Images)"
20250311,NusaPenida,FR-FR,6937590982,"Un paradis bien caché","Broken Beach à Nusa Penida, Bali, Indonésie (© joakimbkk/Getty Images)"
20250312,ChateauLoire,FR-FR,7082040465,"L’histoire de France au fil de l’eau","Château de Sully-sur-Loire, Centre-Val de Loire (© StockPhotoAstur/Shutterstock)"
20250313,HoliColors,FR-FR,7464966633,"Un tourbillon de couleurs et de traditions","Fête de Holi à Jaipur, Inde (© powerofforever/Getty Images)"
20250314,BasqueDolmen,FR-FR,8212950561,"Un ciel de Pi !","Dolmen de Sorginetxe, Pays Basque, Alava, Espagne (© David Herraez Calzada/plainpicture)"
