Enddate,Name,Region,ID,Headline,Copyright
20240501,HawaiianLei,FR-FR,1676452706,"Des colliers venus du Paradis","Colliers de fleurs hawaïens (© Jotika Pun/Shutterstock)"
20240502,CratersOfTheMoon,FR-FR,1896950585,"De la Terre à la Lune","Coulée de lave du Dragon Bleu, Monument national des Cratères de la Lune, Idaho, États-Unis (© Alan Majchrowicz/Getty Images)"
20240503,SonoranSpring,FR-FR,5225084633,"Les fleurs du désert","Encelia farinose en fleur dans le désert de Sonora, Arizona, États-Unis (© Charles Harker/Getty Images)"
20240504,JediMonastery,FR-FR,5584493492,"Que la force soit avec vous !","Ruines d'un ancien monastère sur l'île de Skellig Michael, Irlande (© MNStudio/Getty Images)"
20240505,SanMiguelAllende,FR-FR,6896201862,"Viva Mexico !","Colonnade à San Miguel de Allende, Guanajuato, Mexique (© Mint Images/Getty Images)"
20240506,TheRoachesPeakDistrict,FR-FR,7206874137,"Un paysage qui tombe à pic !","Les Roaches, Peak District, Angleterre (© George W Johnson/Getty Images)"
20240507,LittleDuckling,FR-FR,7460969875,"Trempé comme un canard !","Un caneton nageant dans une prairie d'eau, Suffolk, Angleterre (© Nick Hurst/Getty Images)"
20240508,PortMarseille,FR-FR,3194394496,"海港景色","伊夫堡，马赛，法国 (© Sergii Figurnyi/Alamy)"
20240509,EmirganPark,FR-FR,7936573020,"Explosion de tulipes","Tulipes au parc Emirgan à Istanbul, Turquie (© Ozbalci/Getty Images)"
20240510,MisoolRajaAmpat,FR-FR,9641192055,"Les reflets du paradis","Misool, îles Raja Ampat, Indonésie (© Giordano Cipriani/Getty Images)"
20240511,TexasIndigoBunting,FR-FR,9846433348,"Cet oiseau vous est familier ?","Passerin indigo, perché sur une branche, Texas, États-Unis (© Jeff R Clow/Getty Images)"
20240512,CamargueFlamingos,FR-FR,0995673980,"De drôles de bêtes !","Flamants roses, réserve naturelle de Pont de Gau, Camargue, France (© Yann Guichaoua-Photos/Getty Images)"
20240513,NamibiaCanyon,FR-FR,1473160217,"Le deuxième plus grand canyon du monde","Canyon de la rivière Fish, Namibie (© R. M. Nunes/Getty Images)"
20240514,CarlsbadNP,FR-FR,1644664306,"Voyage au centre de la Terre","Parc national des grottes de Carlsbad, Nouveau-Mexique, États-Unis (© Doug Meek/Getty Images)"
20240515,BlueCityIndia,FR-FR,2415111297,"Ce rêve bleu","La ville bleue de Jodhpur, Inde (© cinoby/Getty Images)"
20240516,DayOfLight,FR-FR,2802585315,"Journée Internationale de la Lumière","Œuvre « Feelings Are Facts », par l'artiste Olafur Eliasson et l'architecte Ma Yansong, Pékin, Chine (© Feng Li/Getty Images News)"
20240517,TarangireElephants,FR-FR,7017565181,"Une famille « éléphantesque » !","Une famille d'éléphants d'Afrique dans le parc national de Tarangire, en Tanzanie (© Vicki Jauron, Babylon and Beyond Photography/Getty Images)"
20240518,MuseumWhale,FR-FR,7280247552,"Courez au musée !","Squelette de baleine bleue appelé Hope, Natural History Museum, Londres, Angleterre (© Bailey-Cooper Photography/Alamy)"
20240519,VernazzaItaly,FR-FR,7493796283,"Là où l'histoire rencontre la mer","Village de Vernazza, Cinque Terre, Ligurie, Italie (© Roberto Moiola/Sysaworld/Getty Images)"
20240520,HoneycombBee,FR-FR,7652566648,"La vie secrète des abeilles","Abeille travaillant dans un nid (© Simun Ascic/Alamy)"
20240521,MalaysiaTea,FR-FR,7897047895,"Un paysage qui inspire la séréni-thé","Plantation de thé des Cameron Highlands, Malaisie (© alex cheong/Getty Images)"
20240522,SnowGumTasmania,FR-FR,8041530043,"L’équilibre délicat de la nature","Eucalyptus coccifera, parc national de Mount Field, Tasmanie, Australie (© Ignacio Palacios/Getty Images)"
20240523,IndianStarTortoise,FR-FR,8197500473,"Quand les carapaces passent…","Tortue étoilée d’Inde, Sri Lanka (© Robin Chittenden/Minden Pictures)"
20240524,OrdesaNationalPark,FR-FR,8382940670,"Un labyrinthique de roche, de forêt et d’eau","Canyon d'Anisclo, Parc national d'Ordesa et Monte Perdido, Huesca, Espagne (© Marisa Estivill/Shutterstock)"
20240525,MoroccoBenhaddou,FR-FR,8548629295,"Les gardiens des dunes","Ksar d’Aït Benhaddou, Maroc (© Grant Faint/Getty Images)"
20240526,MonacoGP,FR-FR,9314919538,"Un Grand Prix mythique","Monte Carlo au crépuscule, Monaco (©  StockByM/Getty Images)"
20240527,Guiana,FR-FR,0757423981,"C’est le grand départ !","Bébé tortue olivâtre quittant le nid pour rejoindre l'océan, plage de Remire-Montjoly, Cayenne, Guyanne (© Brusini Aurélien/hemis.fr)"
20240528,MeteoraMonastery,FR-FR,1071148697,"Toujours plus haut","Monastère de Roussanou, Météores, Thessalie, Grèce (© Marius Roman/Getty Images)"
20240529,MullOtter,FR-FR,1221177605,"Vous voulez ma photo ?","Loutre d'Europe, Loch Spelve, île de Mull, Écosse (© Neil Henderson/Alamy)"
20240530,Everglades90th,FR-FR,1353947188,"Le plus grand écosystème subtropical américain","Pins sylvestres, parc national des Everglades, Floride, États-Unis (© Jonathan Gewirtz/Tandem Stills + Motion)"
20240531,YorkshireDalesNP,FR-FR,1030266814,"Du vert à perte de vue","Gunnerside, Swaledale, Parc national des Yorkshire Dales, Angleterre (© Derek Croucher/Alamy)"
20240601,PrideMonthSF,FR-FR,1847983334,"Porter haut l'étendard de la Fierté","Le Civic Center illuminé pour la San Francisco Pride, Californie, États-Unis (© Josh Edelson/AFP via Getty Images)"
20240602,MenRuz,FR-FR,1588544538,"Quelques mots d'Armor","Phare de Ploumanac'h, Côtes-d'Armor, France (© Christian Handl/Getty Images)"
20240603,CopenhagenBicycles,FR-FR,1244854988,"C’est le moment de perdre les pédales !","Vélos à Copenhague, Danemark (© Alphotographic/Getty Images)"
20240604,ChestnutBeeEater,FR-FR,2288715924,"L’union fait le plumage !","Guêpiers de Leschenault, Parc National de Bardia, Népal (© PACO COMO/Shutterstock)"
20240605,MadagascarRiver,FR-FR,2602472406,"Planète verte, avenir Serein","Parc National de Masoala à Madagascar (© Dennis van de Water/Shutterstock)"
20240606,LesBravesNormandy,FR-FR,2799777837,"Devoir de Mémoire","Monument Les Braves à Omaha Beach, Saint-Laurent-sur-Mer, Normandie (© Christopher Furlong/Getty Images)"
20240607,HumpbackFamily,FR-FR,3059562315,"Vagues d’espoir","Famille de baleines à bosse, Dutch Harbor, Alaska, États-Unis (© Jude Newkirk/Amazing Aerial Agency)"
20240608,KillikRiverAlaska,FR-FR,3251837973,"La rencontre de deux mondes","Confluence de Easter Creek et de la rivière Killik, Parc National des Gates of the Arctic, Alaska, États-Unis (© Patrick J. Endres/Getty Images)"
20240609,BardenasBiosphere,FR-FR,3427127743,"Le désert européen","Réserve de la biosphère et parc naturel de Bardenas Reales, Navarre, Espagne (© Aliaume Chapelle/Tandem Stills + Motion)"
20240610,OsakaNight,FR-FR,3842044387,"La ville aux néons","Osaka la nuit, Japon (© wichianduangsri/Getty Images)"
20240611,GemsbokBotswana,FR-FR,4043133584,"Des animaux uniques","L'oryx gazelle dans la savane, Botswana (© Karine Aigner/Tandem Stills + Motion)"
20240612,BigBendMilkyWay,FR-FR,4230024049,"Un concert galactique","Voie lactée au-dessus du parc national de Big Bend, Texas, États-Unis (© wisanuboonrawd/Adobe Stock)"
20240613,RegistanUzbekistan,FR-FR,4384753959,"Quelle tuile !","Façade en mosaïque sur la place Registan, Samarkand, Ouzbékistan (© da-kuk/Getty Images)"
20240614,PeggysCove,FR-FR,2777171937,"Un phare canadien emblématique","Phare de Peggy's Cove, Nouvelle-Écosse, Canada (© Pugalenthi/Getty Images)"
20240615,NazareWave,FR-FR,3133568548,"En attendant la vague","Surfeur sur une vague à Nazaré, Portugal (© Rui Caria/Getty Images)"
20240616,RedFoxDad,FR-FR,3371995571,"Maître renard et son petit renardeau","Renard roux mâle et son renardeau, Washington, États-Unis (© Chase Dekker/Minden Pictures)"
20240617,FortCigogne,FR-FR,4151283347,"Gare aux corsaires !","Fort Cigogne, archipel des Glénans, Bretagne (© Gerard SIOEN/Getty Images)"
20240618,LupinIceland,FR-FR,4349851245,"Des lupins sans Arsène !","Champs de lupins et église au lever du soleil, péninsule de Snæfellsnes, Islande (© Matteo Colombo/Getty Images)"
20240619,CuxhavenTower,FR-FR,4564976759,"Un monument hors-du-commun","Château d'eau à Cuxhaven, Allemagne (© Andreas Vogel/Alamy)"
20240620,KokinoMacedonia,FR-FR,5105619878,"Le jour le plus long","Kokino, ancien observatoire mégalithique, Macédoine du Nord (© stoimilov/Shutterstock)"
20240621,MusicDayToulouse,FR-FR,5434347440,"Toulouse au diapason","Pont-Neuf à Toulouse (© benkrut/Getty Images)"
20240622,BrazilRainforest,FR-FR,5609224020,"Se perdre dans la brume","Forêt amazonienne, Brésil (© Claus Meyer/plainpicture)"
20240623,DhakaBangladesh,FR-FR,5797372230,"Lumières de la ville","Vue aérienne d'un rond-point à Dacca, Bangladesh (© Azim Khan Ronnie/Amazing Aerial Agency)"
20240624,FloresIsland,FR-FR,5999028657,"Trois lacs pour le prix d’un !","Lacs de cratères volcaniques, volvan Kelimutu, Flores, Indonésie (© Shane P. White/Minden Pictures)"
20240625,FireWave,FR-FR,6210914317,"Chaud devant !","Formation rocheuse Fire Wave, parc d'État de Valley of Fire, Nevada, États-Unis (© Clint Losee/Tandem Stills + Motion)"
20240626,CardinalfishAnemone,FR-FR,6379434981,"Nager comme un poisson dans l’eau !","Poisson cardinal de Banggai et anémone de mer, détroit de Lembeh, Sulawesi du Nord, Indonésie (© Constantinos Petrinos/NPL/Minden Pictures)"
20240627,FlorenceDuomo,FR-FR,6562213181,"Dim, dam, dôme","Cathédrale Santa Maria del Fiore au crépuscule, Florence, Italie (© Elena Pueyo/Getty Images)"
20240628,ParisPrideParade,FR-FR,5537567713,"Célébrons l’amour et la diversité","Drapeau arc-en-ciel brandi devant la tour Eiffel lors de la marche des fiertés (© Yuriko Nakao/Getty Images)"
20240629,TourCorsica,FR-FR,6133264090,"La chasse au maillot jaune est ouverte !","Cyclistes du Tour de France 2013, Corse (© Pascal Pochard-Casabianca/AFP via Getty Images)"
20240630,UbudBali,FR-FR,6392717738,"Ubud, l’oasis spirituelle de Bali","Sculpture sur pierre dans un temple à Ubud, Bali, Indonésie (© R. Schönebaum/plainpicture)"
20240701,FisgardLighthouse,FR-FR,7596685906,"Unis sous la feuille d’érable du Pacifique à l’Atlantique !","Phare de Fisgard, port d'Esquimalt, Colwood, Colombie-Britannique, Canada (© davemantel/Getty Images)"
20240702,ItalicaRuins,FR-FR,7838371593,"Les fantômes des villes du passé","Ancienne ville romaine de Italica à Santiponce, Séville,  Espagne (© Moses Palermo/Amazing Aerial Agency)"
20240703,MeerkatManor,FR-FR,8114816201,"Les sentinelles du désert","Famille de suricates (© anetapics/Shutterstock)"
20240704,SenanqueAbbey,FR-FR,3993123153,"Entre Histoire, lavande et tradition","Abbaye Notre-Dame de Sénanque, Gordes, Provence (© Brzozowska/Getty Images)"
20240705,NoahBeach,FR-FR,8649402194,"Un écrin sauvage entre terre et mer","Plage de Noah, forêt tropicale de Daintree, Queensland, Australie (© bjeayes/Getty Images)"
20240706,ConwyRiver,FR-FR,8883858197,"Un tableau vivant","Château de Conwy surplombant la rivière Conwy, Pays de Galles, Royaume-Uni (© David Chapman/Alamy)"
20240707,YenBaiTerraces,FR-FR,9073206235,"Un paysage qui nous fait « riz-ette » !","Rizières en terrasses de Mu Cang Chaine, Vietnam (© Kiatanan Sugsompian/Getty Images)"
20240708,PontBordeaux,FR-FR,0361302965,"Passage historique sur la Garonne","Pont de pierre, Bordeaux (© SergiyN/Getty Images)"
20240709,TalampayaNP,FR-FR,0885621562,"Des formations rocheuses abracadabrantesques !","Parc national de Talampaya, province de La Rioja, Argentine (© Gonzalo Azumendi/Getty Images)"
20240710,CollaredAracari,FR-FR,3432712660,"Le Toucan Show","Araçari à collier, Costa Rica (© Juan Carlos Vindas/Getty Images)"
20240711,GangiSicily,FR-FR,3620462810,"Vous êtes unique parmi 8,1 milliards de personnes","Gangi, Sicile, Italie (© Andrea Caruso/Amazing Aerial Agency)"
20240712,RainierWildflowers,FR-FR,1422439917,"Zen, restons zen","Fleurs sauvages dans le parc national du Mont Rainier, Washington, États-Unis (© RomanKhomlyak/Getty Images)"
20240713,CappadociaRocks,FR-FR,1620184980,"Question sédimentaire","Cheminées de fées et habitations troglodytes en Cappadoce, Turquie (© Storm Is Me/Shutterstock)"
20240714,BastilleDayParis,FR-FR,2037587707,"Le jour de gloire est arrivé !","La Patrouille de France au-dessus de la pyramide du Louvre pendant la cérémonie du 14 juillet, Paris (© Aurélien Meunier/Getty Images)"
20240715,TateishiPark,FR-FR,2256380829,"Le Japon a le vent en poupe !","Parc de Tateishi, préfecture de Kanagawa, Japon (© blew_s/Shutterstock)"
20240716,AncientOrkney,FR-FR,2608784328,"Fouiller le passé","Site néolithique de Skara Brae, Orcades, Écosse (© Paul Williams - FunkyStock/Getty Images)"
20240717,MedievalRothenburg,FR-FR,2962331926,"Le tour est joué !","Ville médiévale de Rothenburg ob der Tauber, Allemagne (© kanuman/Getty Images)"
20240718,MayotteCoral,FR-FR,3285872398,"Le trésor caché des océans","Récif corallien, Lagon de Mayotte, France (© Gabriel Barathieu/Minden Pictures)"
20240719,YoungJaguar,FR-FR,0618181911,"Un camouflage astucieux","Jeune jaguar au bord d'une rivière, Pantanal, Brésil (© Tambako the Jaguar/Getty Images)"
20240720,MineralMoon,FR-FR,0840269185,"De la Terre à la Lune","La Lune  (© Victor Blum/Getty Images)"
20240721,ZanzibarBoats,FR-FR,1025363657,"Le mythe de l’île aux épices","Bateaux de pêche en bois, village de Kendwa, Zanzibar, Tanzanie (© Lubos Paukeje/Alamy)"
20240722,SaintFrancois,FR-FR,9354176013,"Un joyau caraïbéen","Coucher de soleil sur la plage de l'Anse Champagne à Saint-François, Guadeloupe, Caraïbes (© Fyletto/Getty Images)"
20240723,MethoniCastle,FR-FR,1765128924,"Vestige d’une puissance médiévale","Château de Méthoni, Messénie, Grèce (© Andrew Mayovskyy/Shutterstock)"
20240724,SheepCousins,FR-FR,2246016593,"Cousins, cousines","Troupeau de moutons de Swaledale dans le Yorkshire du Nord, Angleterre (© R A Kearton/Getty Images)"
20240725,SmokyMountainTrail,FR-FR,2588316883,"Le trésor naturel au Tennessee","Chemin forestier dans le parc national des Great Smoky Mountains, Tennessee, États-Unis (© putmanphoto/Getty Images)"
20240726,ParisOlympicGames,FR-FR,9795678627,"« Ouvrons grand les Jeux »","Coucher de soleil sur la Seine avec la Conciergerie, Paris (© Britus/iStock/Getty Images Plus)"
20240727,RhinelandVineyards,FR-FR,9994594641,"La première région viticole d’Allemagne","Vignobles de la vallée de la Moselle, Rhénanie-Palatinat, Allemagne (© Jorg Greuel/Getty Images)"
20240728,BeachHutsSweden,FR-FR,0229761588,"Un rivage suédois pittoresque","Cabines de bain sur la plage, comté de Scanie, Suède (© Martin Wahlborg/Getty Images)"
20240729,CorbettTigers,FR-FR,0494384633,"Le roi du bengale","Tigres dans le parc national de Jim Corbett, Uttarakhand, Inde (© Sourabh Bharti/Getty Images)"
20240730,ImpalaOxpecker,FR-FR,0733173703,"Un roman d’amitié","Impala et pic-bœuf à bec rouge, Afrique du Sud (© Matrishva Vyas/Getty Images)"
20240731,HoodoosBryce,FR-FR,1068853543,"Un paysage à « blu-fée »","Cheminées de fée, Sunset Point, Parc national de Bryce Canyon, Utah, États-Unis (© Tim Fitzharris/Minden Pictures)"
20240801,KaptaiLake,FR-FR,1329932845,"Un marché flottant unique","Marché flottant, lac Kaptai, Rangamati, Bangladesh (© Azim Khan Ronnie/Amazing Aerial Agency)"
20240802,TrunkBay,FR-FR,3550149082,"Quelque part sous l'arc-en-ciel","Trunk Bay, parc national des îles Vierges américaines, Saint John (© cdwheatley/Getty Images)"
20240803,SummerDeer,FR-FR,3909354454,"Rencontre avec les faons chevreuils","Faon chevreuil, Normandie (© slowmotiongli/Getty Images)"
20240804,GimignanoTuscany,FR-FR,0891435828,"Le joyau médiéval de la Toscane","San Gimignano, Sienne, Toscane, Italie (© MNStudio/Shutterstock)"
20240805,HertfordshireLavender,FR-FR,4107363569,"Une mer de pourpre","Champ de lavande, Hertfordshire, Angleterre, Royaume-Uni (© George W Johnson/Getty Images)"
20240806,MolokiniHawaii,FR-FR,4322144539,"Un cratère qui fait des vagues","Cratère de Molokini, Maui, Hawaï, États-Unis (© Douglas Peebles/eStock Photo)"
20240807,MichiganLighthouse,FR-FR,4479492551,"Les gardiens du lac","Phares de Saint-Joseph, Michigan, États-Unis (© Kenneth Keifer/Getty Images)"
20240808,SpottedOwlet,FR-FR,4852852540,"La chouette attitude","Chevêche brame, Bangkok, Thaïlande (© Tfilm/Getty Images)"
20240809,IncaRuinPeru,FR-FR,7059028916,"Célébrons la culture autochtone","Ruine inca de Sacsayhuamán près de Cusco, Pérou (© SL_Photography/Getty Images)"
20240810,JoshuaTreeNP,FR-FR,7411748387,"Un paysage venu d’un autre monde","Parc national de Joshua Tree, Californie, États-Unis (© Chris Moore - Exploring Light Photography/Tandem Stills + Motion)"
20240811,TofinoVancouver,FR-FR,7602637860,"Le chemin le moins fréquenté","Sentier en bois menant au lac Kennedy, île de Vancouver, Colombie-Britannique, Canada (© EB Adventure Photography/Shutterstock)"
20240812,ElephantsAmboseli,FR-FR,7826915061,"Un engagement planétaire pour sauver ces géants","Éléphants d'Afrique, parc national d'Amboseli, Kenya (© Ruzdi Ekenheim/Getty Images)"
20240813,LorientCelticFestival,FR-FR,2950316084,"À vos binious !","Citadelle de Port Louis, Lorient, Morbihan, France (© Philippe TURPIN/Getty Images)"
20240814,WatarrkaLizard,FR-FR,2192982199,"Qui s'y frotte s'y pique !","Diable épineux, parc national de Watarrka, Australie (© Yva Momatiuk and John Eastcott/Minden Pictures)"
20240815,HangCave,FR-FR,1926415619,"La cathédrale naturelle du Vietnam","Grotte de Hang Son Doong, Parc national de Phong Nha-Ke Bang, Vietnam (© Geng Xu/Getty Images)"
20240816,ButterflyFlower,FR-FR,4834672236,"Un tableau idyllique","Papillon et fleur de lavande au lever du soleil, France (© Konstanttin/Getty Images)"
20240817,AlfanzinaLighthouse,FR-FR,9974749595,"Les sentinelles de la mer","Phare d'Alfanzina, Algarve, Portugal (© Andreas Kunz/Getty Images)"
20240818,HuntingtonBeach,FR-FR,9728078384,"Le quai mythique de Californie","Quai de Huntington Beach, Californie, États-Unis (© Stan Moniz Photography/Tandem Stills + Motion)"
20240819,RegataSanGines,FR-FR,9512852239,"Un petit plongeon ?","Bufadero de la Garita, Grande Canarie, Espagne (© Marco Bottigelli/Getty Images)"
20240820,TetonSunrise,FR-FR,5273170982,"Entre ciel et terre","Lever de soleil dans le parc national de Grand Teton, Wyoming, États-Unis (© Kurt Budliger/Tandem Stills + Motion)"
20240821,NazcaBooby,FR-FR,8760221120,"Des découvertes à Galápa-gogo","Fou de Grant, île Wolf, îles Galápagos, Équateur (© Tui De Roy/Minden Pictures)"
20240822,OceanCityMD,FR-FR,8531122070,"Lueur matinale","Vue aérienne d’Ocean City au lever du soleil, Maryland, États-Unis (© Kevin Olson/Amazing Aerial Agency)"
20240823,PrasatPhanom,FR-FR,7783025478,"Une porte ouverte sur le passé","Ruines du temple de Prasat Phanom Rung, province de Buriram, Thaïlande (© Banjongseal324/Getty Images)"
20240824,KatahdinWoods,FR-FR,8416030061,"De l’eau et des bois","Katahdin Woods and Waters National Monument, comté de Penobscot, Maine, États-Unis (© Cavan Images/Alamy)"
20240825,TrailMontBlanc,FR-FR,5602937641,"L’émeraude des Alpes","Reflet du ciel sur le lac Blanc, Alpes françaises, Monte Bianco en arrière-plan, Chamonix (© Smitt/Getty Image)"
20240826,PalmyraAtoll,FR-FR,9486167153,"Une petite escapade idyllique ?","Réserve naturelle nationale de l'atoll de Palmyra, océan Pacifique central (© Ian Shive/Tandem Stills + Motion)"
20240827,YoungCaiman,FR-FR,4221031673,"L’appel du marais","Jeune caïman noir, réserve nationale de Tambopata, Pérou (© Maxime Aliaga/Minden Pictures)"
20240828,PontNeuf,FR-FR,7590326569,"Célébrons la résilience !","Pont Neuf sur la Seine, Paris, France (© f11photo/Getty Images)"
20240829,CastellfollitSpain,FR-FR,5347167823,"Le joyau de la Catalogne","Castellfollit de la Roca, Catalogne, Espagne (© Eloi_Omella/Getty Images)"
20240830,WhaleSharkDay,FR-FR,7922497271,"La douceur d’un géant","Requin-baleine dans la baie de Cenderawasih, Papouasie occidentale, Indonésie (© Andy Lerner/Tandem Stills + Motion)"
20240831,DjanetAlgeria,FR-FR,8225562823,"Il était une fois le désert","Formations rocheuses et dunes de sable dans le Sahara, Djanet, Algérie (© Airpano/Amazing Aerial Agency)"
20240901,ThamesLondon,FR-FR,8520495131,"Au flux de la mémoire britannique","Tamise, Londres, Angleterre (© Puthipong Worasaran/Getty Images)"
20240902,PenitentMees,FR-FR,9818550884,"Les Géants de la Haute-Provence","Les Pénitents des Mées, Alpes-de-Haute-Provence (© Cavalier Michel/Hemis/Alamy Stock Photo)"
20240903,AlpineLakes,FR-FR,5224136914,"Une beauté intacte comme au premier jour","Lac Crystal dans les Enchantments, Alpine Lakes Wilderness, Washington, États-Unis (© Mitch Pittman/Tandem Stills + Motion)"
20240904,DuskyOwls,FR-FR,0673543438,"Les seigneurs de la nuit","Grand-duc de Coromandel, Pakistan (© zahoor salmi/Getty Images)"
20240905,TIFF2024,FR-FR,7898842904,"Clap, moteur, ça tourne !","Vue de la ville de Toronto depuis le lac Ontario, Canada (© Roberto Machado Noa/Getty Images)"
20240906,AmericanDeauvilleFestival,FR-FR,8608848742,"Moteur… action !","Cabines de plage à Deauville, France (© Skayamauritius images GmbH/Alamy Stock Photo)"
20240907,SantaCruzHummer,FR-FR,8767186794,"En chantant...","Colibri d'Anna, Santa Cruz, Californie, États-Unis (© yhelfman/Getty Images)"
20240908,StockholmLibrary,FR-FR,9141421030,"Un chapitre qui s’écrit ensemble","Intérieur de la bibliothèque publique de Stockholm, Suède (© Andrei Hrabun/Alamy)"
20240909,IguazuRainbow,FR-FR,9313574193,"Quand les arcs-en-ciel s’en mêlent","Chutes d'Iguazu à la frontière entre l'Argentine et le Brésil (© AirPano LLC/Amazing Aerial Agency)"
20240910,BridgeLisbon,FR-FR,9704936027,"De l’horizon à la mer","Pont Vasco de Gama, Lisbonne, Portugal (© Achim Thomae/Getty Images)"
20240911,EltzCastle,FR-FR,9929668826,"Château d’Eltz, Allemagne","Château d'Eltz, Allemagne (© Allard Schager/Alamy)"
20240912,DolphinReunion,FR-FR,0184396607,"Le grand bleu","Pod de dauphins près de l'île de la Réunion, océan Indien (© Joost van Uffelen/Shutterstock)"
20240913,PointReyes,FR-FR,0377202822,"Un havre de paix et de nature","Phare de l’aire côtière protégée de Point Reyes, Californie, États-Unis (© RMB Images/Photography by Robert Bowman/Getty Images)"
20240914,RapaNuiSunrise,FR-FR,0534822135,"De bon moaï-tin","Lever de soleil à Ahu Tongariki, parc national de Rapa Nui, île de Pâques, Chili (© Piriya Photography/Getty Images)"
20240915,CalabriaPeperoncino,FR-FR,0822253215,"Rouge piment et bleu azur","Plage d'Arco Magno, Calabre, Italie (© Alessio de Cicco/Getty Images)"
20240916,SunriseWallabies,FR-FR,1107245942,"Au saut du lit","Wallabies au lever du soleil, rivière Adelaïde, Territoire du Nord, Australie (© Jeremy Woodhouse/Getty Images)"
20240917,NordicWalkingDay,FR-FR,1412128674,"En marche !","Vue aérienne de champs géométriques de raisin, vignoble en Alsace (© Alexander Sorokopud/Alamy Stock Photo)"
20240918,GujoHachiman,FR-FR,1605630102,"Le château dans les nuages","Château de Gujō Hachiman, préfecture de Gifu, Japon (© ta2funk ito/500px/Getty Images)"
20240919,PiratePlayground,FR-FR,1786944453,"En avant, moussaillons !","Aire de jeux du phare d'Obereversand à Dorum-Neufeld, Allemagne (© INGO WAGNER/DPA/AFP via Getty Images)"
20240920,OcracokeLight,FR-FR,4610560475,"L'ultime refuge des flibustiers","Phare de l’île d'Ocracoke, Caroline du Nord, États-Unis (© Chansak Joe/Getty Images)"
20240921,MunichBeerfest,FR-FR,4864726596,"Le paradis des lève-chopes !","Panorama sur l’Oktoberfest au coucher du soleil, Munich, Allemagne (© AllesSuper21/iStock/Getty Images)"
20240922,AutumnCumbria,FR-FR,5040860299,"Symphonie de couleurs automnales","Buttermere, Parc national du Lake District, Angleterre, Royaume-Uni (© Alan Novelli/Alamy)"
20240923,IcebergOtter,FR-FR,6372895513,"La gardienne des océans","Loutre de mer, baie de Prince William Sound, Alaska, États-Unis (© Gerald Corsi/Getty Images)"
20240924,SkaftafellWaterfall,FR-FR,6109608745,"La perle islandaise","Cascade de Skaftafell, Parc national du Vatnajökull, Islande  (© Nopasorn Kowathanakul/Getty Images)"
20240925,GiantSequoias,FR-FR,6286299520,"Le royaume des géants","Séquoias géants, parc national de Sequoia, Californie, États-Unis (© Galyna Andrushko/Shutterstock)"
20240926,LittleToucanet,FR-FR,6494819106,"C’est qui le plus beau ?","Toucanet à gorge bleue, parc national de Los Quetzales, Costa Rica (© Oscar Dominguez/Tandem Stills + Motion)"
20240927,VeniceAerial,FR-FR,6953765883,"La ville aux reflets éternels","Vue aérienne du Grand Canal et de la Basilique de Santa Maria della Salute, Venise, Italie (© Bachir Moukarzel/Amazing Aerial Agency)"
20240928,Calanques,FR-FR,0746554630,"Un paradis de roches et de mer","Calanque d'En-Vau, parc national des Calanques, Côte d’Azur (© Marco Bottigelli/Getty Images)"
20240929,ConnecticutBridge,FR-FR,7429205429,"Connecter le Connecticut","Pont couvert de West Cornwall, Connecticut, États-Unis (© pabradyphoto/Getty Images)"
20240930,WalrusNorway,FR-FR,7720633586,"Silence, ça pose !","Troupeau de morses dans le nord du Spitzberg, archipel du Svalbard, Norvège (© AWL Images/Danita Delimont)"
20241001,BoraPapeete,FR-FR,3866752919,"Là où le rêve devient réalité","Vue aérienne de Bora-Bora, Polynésie française (© GLF Media/Shutterstock)"
20241002,WindRiverAlaska,FR-FR,4031245371,"La danse sauvage de la rivière","Wind River, Brooks Range, Refuge faunique national de l'Arctique, Alaska, États-Unis (© Design Pics/Danita Delimont)"
20241003,TajMahalReflection,FR-FR,4211320657,"Le symbole de l’amour éternel","Taj Mahal à Agra, Uttar Pradesh, Inde (© Tanarch/Getty Images)"
20241004,EuropaMoon,FR-FR,8860978550,"La lune bleue veille","Europe, la lune glacée de Jupiter (© NASA/JPL-Caltech/SETI Institute)"
