Enddate,Name,Region,ID,Headline,Copyright
20240501,HawaiianLei,IT-IT,8543155647,"Primo Maggio alle Hawaii","Ghirlande di fiori hawaiani, Hawaii, Stati Uniti (© Jotika Pun/Shutterstock)"
20240502,CratersOfTheMoon,IT-IT,8708957821,"Fino alla luna e ritorno","Flusso di lava del Drago Blu, Monumento e riserva nazionale Craters of the Moon, Idaho, USA (© Alan Majchrowicz/Getty Images)"
20240503,SonoranSpring,IT-IT,9351993894,"Anche i deserti fioriscono!","Fioritura primaverile dei cespugli, deserto di Sonora, Arizona, Stati Uniti (© Charles Harker/Getty Images)"
20240504,GirodItalia2024,IT-IT,9407204320,"Perchè tutti in bici?","Giro d'Italia, Ciclisti sulle Dolomiti (© Tim de Waele/Staff/Getty Images)"
20240505,OrkneyStones,IT-IT,2078101217,"Che massi imponenti!","Il Cerchio di Brodgar, Orcadi, Scozia (© Paul Williams - FunkyStock/Getty Images)"
