Enddate,Name,Region,ID,Headline,Copyright
20241004,EuropaMoon,JA-JP,4639297209,"今日から世界宇宙週間","木星の衛星エウロパ (© NASA/JPL-Caltech/SETI Institute)"
20241005,ElephantTeacher,JA-JP,4940024317,"今日は世界教師デー","ツァボイースト国立公園のアフリカゾウ, ケニア (© Neil Bowman/Minden Pictures)"
20241006,KochiaJapan,JA-JP,5196113182,"真っ赤なコキア","国営ひたち海浜公園, 茨城県 ひたちなか市 (© DigiPub/Getty Images)"
20241007,ElbePhilharmonic,JA-JP,5541486306,"今日は世界建築の日","エルプフィルハーモニー・ハンブルク, ドイツ (© Canetti/Shutterstock)"
20241008,Kanro2024,JA-JP,5787966494,"今日は寒露","秋の八甲田ロープウェイ,  青森県 青森市 (© Torsakarin/Getty Images)"
20241009,AspensColorado,JA-JP,6244858068,"黄葉に輝く森","マーブル近郊に自生するアスペン, 米国 コロラド州 (© Jason Hatfield/Tandem Stills + Motion)"
20241010,SoranoItaly,JA-JP,6459075522,"断崖絶壁の上に佇む町","ソラーノ, イタリア トスカーナ州 (© Luigi Vaccarella/eStock Photo)"
20241011,CelticColours,JA-JP,6953032126,"紅葉に染まる島","ケープ・ブレトン島, カナダ ノバスコシア州 (© Cavan Images/Alamy)"
20241012,QuebecDuck,JA-JP,7270367085,"今日は「世界渡り鳥の日」","アメリカオシ, カナダ ケベック州 (© Maxime Riendeau/Getty Images)"
20241013,AlcazarSeville,JA-JP,7812179664,"美しいアーチに囲まれた「乙女の中庭」","アルカサル, スペイン アンダルシア州 (© Danny Lehman/Getty Images)"
20241014,RailwaysDayNew,JA-JP,8050699925,"今日は鉄道の日","東京駅, 東京都 (© phutthiseth thongtae/Getty Images)"
20241015,FossilsDorset,JA-JP,8513856980,"今日は「化石の日」","ジュラシック・コーストの化石, イギリス ドーセット州 (© Nature Picture Library/Alamy)"
20241016,MaraMigration,JA-JP,8727709922,"大自然の壮大なドラマ","マラ川を渡るヌーの群れ, ケニア (© Ayzenstayn/Getty Images)"
20241017,CoyoteGulch,JA-JP,8998470067,"色鮮やかな砂岩のアーチ","グレンキャニオン国立保養地, 米国 ユタ州 (© Stephen Matera/Tandem Stills + Motion)"
20241018,CentralParkAutumn,JA-JP,2757358246,"邂逅秋日的林荫道","曼哈顿中央公园的秋天，纽约，美国 (© mapman/Shutterstock)"
20241019,DenderaTemple,JA-JP,4353072440,"今日は国際考古学の日","ハトホル神殿, エジプト ケナ県 (© Nick Brundle Photography/Getty Images)"
20241020,SmilingSloth,JA-JP,4479144213,"今日は国際ナマケモノデー","木の枝にぶら下がるナマケモノ, コスタリカ (© Harry Collins/Getty Images)"
20241021,AutumnCypress,JA-JP,4647054612,"水に浮かぶ森","ジョージ・エル・スミス州立公園, 米国 ジョージア州 (© Chris Moore/TANDEM Stills + Motion)"
20241022,HeianJingu2024,JA-JP,4866409141,"今日は平安遷都の日","平安神宮, 京都府 京都市 (© Ulana Switucha/Alamy Stock Photo)"
20241023,HottaiFalls2024,JA-JP,5036595123,"今日は霜降","紅葉に包まれた法体の滝, 秋田県 由利本荘市 (© nattya3714/Getty Images)"
20241024,BodieCalifornia,JA-JP,5239125800,"ゴールドラッシュで栄えた鉱山街","ボディ州立歴史公園, 米国 カリフォルニア州 (© Julien McRoberts/Tetra Images, LLC/Alamy)"
20241025,MontBlancMassif,JA-JP,5454742573,"雲海に浮かぶ山々","シャモニー, フランス (© Simon Schöpf/Getty Images)"
20241026,GhostForest,JA-JP,5609597853,"バルト海沿岸の枯れた森林","ニーンハーゲンのゴーストフォレスト, ドイツ メクレンブルク ＝ フォアポンメルン州 (© mauritius images GmbH/Alamy)"
20241027,PolarBearHug,JA-JP,5883977862,"今日から国際ホッキョクグマ週間","寄り添うホッキョクグマの親子, カナダ マニトバ州 (© Design Pics/plainpicture)"
20241028,PumpkinMist,JA-JP,6129439723,"一面オレンジの畑と朝霧","ビクトリアのパンプキン畑, カナダ ブリティッシュコロンビア州 (© Shaun Cunningham/Alamy)"
20241029,GreatOwl,JA-JP,6299309375,"暗闇のスーパーハンター","アメリカワシミミズク (© Mark Newman/Getty Images)"
20241030,HauntedEdinburgh,JA-JP,6454143527,"岩頸の上に建つ要塞","エディンバラ城, イギリス (© Chris Dorney/Alamy)"
20241031,Halloween2024,JA-JP,6692896772,"今日はハロウィン","草間彌生の「南瓜」, 香川県 香川郡 (© hedgehog111/Shutterstock)"
20241101,LencoisMaranhao,JA-JP,9337793324,"白い砂丘に現れる奇跡の湖","レンソイス・マラニャンセス国立公園, ブラジル マラニャン州 (© thanosquest/Shutterstock)"
20241102,BisonYellowstone,JA-JP,3698112107,"草原を歩き回るアメリカバイソン","イエローストーン国立公園, 米国 ワイオミング州 (© Ian Shive/TANDEM Stills + Motion)"
20241103,YucatanBiosphere,JA-JP,2886303469,"今日は国際生物圏保存地域の日","リア・ラガルトス生物圏保護区, メキシコ ユカタン州 (© Claudio Contreras/Minden Pictures)"
20241104,CumbriaAutumn,JA-JP,9920066326,"ワーズワスが過ごした美しい村","グラスミア, イングランド カンブリア州 (© Thomas Molyneux/Getty Images)"
20241105,Torinoichi2024,JA-JP,3936994887,"今日は一の酉","酉の市で販売される縁起熊手, 東京 (© ASSOCIATED PRESS/AP)"
20241106,ShiShiBeach,JA-JP,1245886715,"海食柱で有名なシーシービーチ","オリンピック国立公園, 米国 ワシントン州 (© T.M. Schultze/TANDEM Stills + Motion)"
20241107,AnserAlbifrons2024,JA-JP,4172907824,"今日は立冬","マガンの群れ (© feathercollector/Shutterstock)"
20241108,GlacialRivers,JA-JP,1694776093,"氷と火の交響曲","氷河河川システムの航空写真, アイスランド (© rybarmarekk/Shutterstock)"
20241109,MoroccoMilkyWay,JA-JP,1854707696,"集落の上空に広がる天の川","アイト・ベン・ハドゥの集落, モロッコ (© Cavan Images/Getty Images)"
20241110,YucatanFlamingos,JA-JP,2002783035,"上空から見たフラミンゴたちの群舞","ユカタン半島のベニイロフラミンゴ, メキシコ  (© Claudio Contreras/NPL/Minden Pictures)"
20241111,Banff24,JA-JP,2138489803,"湖に映る雄大な山","バンフ国立公園,カナダ アルバータ州 (© fywPhoto 云卷云舒/Getty Images)"
20241112,CoveArch,JA-JP,2301146228,"自然にできた砂岩のアーチ","アーチーズ国立公園, 米国 ユタ州 (© Jeff Foott/Minden Pictures)"
20241113,KelpForest,JA-JP,2433405735,"オオウキモとカリフォルニアアシカ","海の中にある森, メキシコ バハ・カリフォルニア州  (© Claudio Contreras/Minden Pictures)"
20241114,ManarolaItaly,JA-JP,2558854780,"断崖絶壁にあるカラフルな漁村","マナローラ,  イタリア リグーリア州 (© John_Silver/Shutterstock)"
20241115,YiPengLanterns,JA-JP,3002354354,"今日はチェンマイ・イーペン祭り","夜空に浮かぶ無数の灯籠, タイ (© tampatra/Getty Images)"
20241116,FrieslandNetherlands,JA-JP,3280523442,"世界最大の干潟地帯","ワッデン海, オランダ フリースラント州 (© Ron ter Burg/Minden Pictures)"
20241117,RedStag,JA-JP,3676294833,"森の精霊","アフリック峡谷のアカシカ, スコットランド ハイランド地方 (© Terry Whittaker/Alamy)"
20241118,PorthcawlLighthouse,JA-JP,3933854148,"荒波が打ち付ける灯台","ポースコール灯台, イギリス 南ウェールズ (© Leighton Collins/Alamy)"
20241119,TasmansArch,JA-JP,4122919606,"自然の岩のアーチ","タスマン国立公園, オーストラリア タスマニア州 (© Gary Bell/Minden Pictures)"
20241120,BeyondSaype,JA-JP,4402963918,"今日は世界こどもの日","Saype によるランドアート「 Beyond Crisis 」, スイス (© VALENTIN FLAURAUD/EPA-EFE/Shutterstock)"
20241121,LionCubs,JA-JP,4693137175,"未来のサバンナの王者","寄り添う 2 頭の子ライオン, 南アフリカ (© Ruan Springorum/Getty Images)"
20241122,Xiaoxue2024,JA-JP,4930643570,"今日は小雪","白糸の滝, 静岡県 富士宮市 (© Sean Pavone/Alamy Stock Photo)"
20241123,FibonacciAloe,JA-JP,5597690966,"今日はフィボナッチ数の日","カンガルー島のスパイラルアロエ, オーストラリア (© Michael Melford/Alamy)"
20241124,SonomaCoast,JA-JP,5834035051,"海に浮かぶ岩礁群","ソノマコースト州立公園, 米国 カリフォルニア州 (© Rachid Dahnoun/Tandem Stills + Motion)"
20241125,AmboseliGiraffes,JA-JP,2992203136,"広大なサバンナを歩き回るマサイキリン","アンボセリ国立公園, ケニア (© Art Wolfe/DanitaDelimont.com)"
20241126,HotBathDay2024,JA-JP,6338825094,"今日はいい風呂の日","金鱗湖の鳥居, 大分県 由布市 (© T-Mizuguchi/Shutterstock)"
20241127,SemoisRiver,JA-JP,6578585711,"伝説の巨人が眠る場所？","セモワ川が作り出した壮大な蛇行地形, ベルギー (© David Briard/Getty)"
20241128,ZafraCastle,JA-JP,6761146829,"岩山の上に建つ難攻不落の城","ザフラ城, スペイン グアダラハラ県 (© Eduard Gene/Getty Images)"
20241129,MtStMichel,JA-JP,4975687728,"サン・マロ湾の上に浮かぶ美しい修道院","モンサンミッシェル, フランス (© Captain Skyhigh/Getty Images)"
20241130,KilchurnAutumn,JA-JP,5172394807,"今日は聖アンデレの日","水面に映るキルチャーン城, スコットランド (© Tom Mackie/plainpicture)"
20241201,IcebergsAntarctica,JA-JP,7385959905,"今日は南極条約が採択された日","南極大陸の氷山 (© Art Wolfe/DanitaDelimont.com)"
20241202,SnowMoose,JA-JP,7555569429,"北欧の森に生息する巨人","デナリ国立公園のヘラジカ, 米国 アラスカ州  (© Cavan Images/Alamy)"
20241203,ChichibuFestival2024,JA-JP,7708851590,"今日は秩父夜祭・本祭","花火と豪華な山車,埼玉県 秩父市 (© ASSOCIATED PRESS/AP)"
20241204,RhinosKenya,JA-JP,7911615612,"今日は世界動物の日","シロサイの顔合わせ, ケニア (© Ingo Arndt/Minden Pictures)"
20241205,MonoTufa,JA-JP,8066767108,"石灰岩の柱がそびえる不思議な湖","モノ湖, 米国 カリフォルニア州 (© Susanna Patras/TANDEM Stills + Motion)"
20241206,HelsinkiDusk,JA-JP,8216541034,"今日はフィンランドの独立記念日","ヘルシンキの旧市街, フィンランド (© Oleksiy Mark/Shutterstock)"
20241207,Daxue2024,JA-JP,8353318760,"今日は大雪","雪化粧の五稜郭, 北海道 函館 (© Hiro1775/Getty Images)"
20241208,ReopeningNotreDame,JA-JP,8512031523,"炎を越えた大聖堂、再びその扉を開く！","ノートルダム大聖堂, フランス パリ (© Julien Fromentin/Getty Images)"
20241209,GuanacosChile,JA-JP,8670867516,"今日はリャマの日","トーレス・デル・パイネ国立公園のグアナコ, チリ (© Floris van Breugel/NPL/Minden Pictures)"
20241210,CornwallSnow,JA-JP,8878820207,"イギリス本土最西端の地","ランズ・エンド, イギリス コーンウォール州 (© Josef FitzGerald-Patrick/Getty Images)"
20241211,DolomitesSky,JA-JP,9035342357,"今日は国際山岳デー","トレ・チーメ・ディ・ラヴァレード, イタリア (© Daniel Maran/Getty Images)"
20241212,WildPoinsettia,JA-JP,9224856071,"今日はポインセチアの日","クリスマスを象徴する美しい植物 (© David Hosking/NPL/Minden Pictures)"
20241213,ChristmasBudapest,JA-JP,6583292404,"賑やかなクリスマスマーケット","聖イシュトヴァーン大聖堂, ハンガリー (© Calin Stan/Shutterstock)"
20241214,NorthernHawkOwl,JA-JP,7268842450,"今日はクリスマス・バード・カウント","オナガフクロウ, カナダ (© pchoui/Getty Images)"
20241215,MisurinaLake,JA-JP,7561735635,"鏡のように壮大な山々を映す湖","ミズリーナ湖, イタリア (© Marco Bottigelli/Getty Images)"
20241216,SalzburgSnow,JA-JP,7845943575,"雪化粧した旧市街","ザルツブルク, オーストリア (© bluejayphoto/Getty Images)"
20241217,ReinefjordenNorway,JA-JP,8145740016,"赤い木造の漁師小屋","美しい村レーヌ, ノルウェー (© Pilat666/Getty Images)"
20241218,NutcrackerBallet,JA-JP,8484350110,"クリスマスシーズン恒例のバレエ公演","くるみ割り人形 (© Caroline Holden/Alamy)"
20241219,SibiuRomania,JA-JP,9171991249,"大広場で開かれるクリスマスマーケット","歴史的な都市シビウ, ルーマニア (© Calin Stan/Alamy)"
20241220,SantaClausVillage,JA-JP,9442890850,"雪に覆われたきらびやかな村","ロヴァニエミ近郊のサンタクロース村, フィンランド (© Smelov/Shutterstock)"
20241221,BluePond2024,JA-JP,2198755551,"今日は冬至","ライトアップされた青い池, 北海道 美瑛町 (© Sean Pavone/Alamy Stock Photo)"
20241222,FestivusCranes,JA-JP,9750730538,"今日は夫婦の日","釧路湿原のタンチョウ, 北海道 (© Wirestock, Inc./Alamy)"
20241223,TokyoTower2024,JA-JP,2762394000,"今日は東京タワー完工の日","けやき坂のイルミネーション, 東京 (© Kinsei-TGS/Getty Images)"
20241224,SantaSnowglobe,JA-JP,0084831582,"今日はクリスマス・イブ","クリスマスマーケットの工芸品, ドイツ (© Cyril Gosselin/Getty Images)"
20241225,ReindeerTrio,JA-JP,0425560339,"今日はクリスマス","スヴァールバル諸島のトナカイ, ノルウェー (© Martin Zwick/REDA&amp;CO/Universal Images Group via Getty Images)"
20241226,MouseholeXmas,JA-JP,0779815955,"今日はボクシング・デー","マウゼル, イングランド (© ianwool/Getty Images)"
20241227,LakeBledSnow,JA-JP,5075131023,"おとぎ話の世界","ブレッド湖, スロベニア (© Kesu01/Getty Images)"
20241228,CoralTurtle,JA-JP,5618879842,"今日は米国絶滅危惧種保護法制定の日","アオウミガメ, フランス (© Damsea/Shutterstock)"
20241229,BorobudurBells,JA-JP,5888220367,"仏教の世界観を表した寺院","ボロブドゥール遺跡, インドネシア (© Robertharding/Shutterstock)"
20241230,MountFieldNP,JA-JP,6160592179,"タスマニア固有のユニークな植物","マウントフィールド国立公園, オーストラリア (© Whitworth Images/Getty Images)"
20241231,Omisoka2024,JA-JP,6408751475,"今日は大晦日","平等院の梵鐘, 京都 (© Asia Images Group LLC/Alamy Stock Photo)"
20250101,ShirahigeSunrise2024,JA-JP,6695296609,"今日は元日","朝日と白髭神社の鳥居, 滋賀県 高島市 (© Cavan Images/Alamy Stock Photo)"
20250102,PlumParakeet,JA-JP,6915629740,"カラフルな鳥","コセイインコ, インド カルナータカ州 (© Hira Punjabi/Alamy)"
20250103,TolkienOxford,JA-JP,7219183666,"今日はトールキンの誕生日","オックスフォード大学の図書館, イギリス (© atiger/Shutterstock)"
20250104,BouldersNZ,JA-JP,7494581439,"今日は石の日","丸い巨石が転がる海岸, ニュージーランド (© Douglas Pearson/eStock Photo)"
20250105,ArdezSwitzerland,JA-JP,7833129331,"今日は小寒","アルデッツ村, スイス (© Roberto Moiola/Getty Images)"
20250106,RavennaBasilica,JA-JP,8188667597,"水没した地下聖堂","サン・フランチェスコ聖堂, イタリア (© Andrea Pucci/Getty Images)"
20250107,VietnamFalls,JA-JP,8519812125,"豊かな自然に囲まれた壮大な滝","バンゾック滝, ベトナム (© Shane P. White/Minden Pictures)"
20250108,GreatWallStairs,JA-JP,2827072518,"今日は「勝負事の日」","雪化粧した万里の長城, 中国 (© View Stock/Alamy)"
20250109,NamibiaDunes,JA-JP,9057669220,"赤く染まる砂丘","ナミブ砂漠, ナミビア (© Airpano/Amazing Aerial Agency)"
20250110,BubbleLake,JA-JP,3345547738,"アイスバブルの聖地","アブラハム湖, カナダ アルバータ州 (© Basic Elements Photography/Getty Images)"
20250111,MeknesMorocco,JA-JP,3587132795,"巨大な穀物倉庫","古都メクネス, モロッコ (© Calin Stan/Shutterstock)"
20250112,CadizSpain,JA-JP,3855173491,"エメラルド色の湖と白い村","サアラ・デ・ラ・シエラ,  スペイン (© SEN LI/Getty Images)"
20250113,CoastalWales,JA-JP,4408975920,"今日はウェールズの新年","イニス・ランドウィン, ウェールズ (© Westend61 on Offset/Shutterstock)"
20250114,MuseumCourt,JA-JP,4665250059,"明日は大英博物館の開館日","大英博物館, イギリス (© Cavan Images/Offset/Shutterstock)"
20250115,Mochibana2025,JA-JP,8291657654,"今日は小正月","カラフルな餅花, 愛知県 豊田市 (© Photo taken by Bong Grit/Getty Images)"
20250116,PinnaclesPeaks,JA-JP,8554679211,"夕日に輝く奇石群","ピナクルズ国立公園, 米国 カリフォルニア州 (© yhelfman/Getty Images)"
20250117,AssiniboineTS,JA-JP,8766031351,"天を突き刺すような山と雪煙","マウント・アシニボイン州立公園, カナダ ブリティッシュコロンビア州 (© Jeff Lewis/TANDEM Stills + Motion)"
20250118,WhiteSandsNP,JA-JP,9246270172,"雪原のような石膏砂漠","ホワイトサンズ国立公園, 米国 ニューメキシコ州  (© Image Professionals GmbH/Alamy)"
20250119,NeptunesGrotto,JA-JP,9457027054,"鍾乳石と石筍の世界","ネプチューンの洞窟, イタリア (© Carlo Murenu/Getty Images)"
20250120,Daikan2025,JA-JP,9667984098,"今日は「大寒」","コタンの湯, 北海道 川上郡 (© NitiChuysakul Photography/Getty Images)"
20250121,DutchSquirrel,JA-JP,6210839377,"今日は米国の「リス感謝デー」","キタリスとキノコ, オランダ (© Edwin Giesbers/Minden Pictures)"
20250122,PetraMonastery,JA-JP,0333984762,"バラ色に染まる古代都市","ペトラ, ヨルダン (© Punnawit Suwuttananun/Getty Images)"
20250123,DeerValley,JA-JP,0604255662,"今日からサンダンス映画祭","雪化粧したパークシティ, 米国 ユタ州 (© Adventure_Photo/Getty Images)"
20250124,IcelandGeyser,JA-JP,3899461242,"地球の息吹を感じる場所","ストロックル間欠泉, アイスランド (© John and Tina Reid/Getty Images)"
20250125,PortoSunset,JA-JP,4070269520,"ドウロ川の夕暮れ","ポルト, ポルトガル (© Starcevic/Getty Images)"
20250126,FrostedBeech,JA-JP,4239876315,"見渡す限りの銀世界","霧氷のブナ林, ベルギー (© Philippe Moes/Minden Pictures)"
20250127,CanyonSnow,JA-JP,4445810449,"時の流れが刻んだ奇跡の大地","グランド・キャニオン国立公園, 米国 アリゾナ州 (© Nick Lake/Tandem Stills + Motion)"
20250128,FlyingOwl,JA-JP,5099744024,"狩りの名手","吹雪の中を飛ぶコミミズク (© Dilshan Muthalib/Getty Images)"
20250129,LunarDragon,JA-JP,5285145740,"今日は中国の春節","鉄の花の中で舞う龍舞, 中国 湖北省 (© Miao Jian/Wuhan Morning Post/Visual China Group via Getty Images)"
20250130,OrdesaSpain,JA-JP,5528658967,"ローランの裂け目","オルデサ・イ・モンテ・ペルディード国立公園, スペイン (© Inaki Relanzon/Nature Picture Library/Alamy)"
20250131,PlainsZebra,JA-JP,5699662720,"今日は国際シマウマの日","モカラ国立公園, 南アフリカ (© EcoPrint/Shutterstock)"
20250201,GoldenBridge,JA-JP,5870058784,"「神の手」に支えられた橋","ゴールデンブリッジ, ベトナム (© Hien Phung Thu/Shutterstock)"
20250202,AustriaMarmot,JA-JP,6210470300,"今日はグラウンドホッグデー","アルプスマーモット, 米国 ペンシルバニア州 (© Jonas Fichtner-Pflaum/Getty Images)"
20250203,Risshun2025,JA-JP,6529014440,"今日は立春","梅の花で吸蜜するメジロ (© yankane/shutterstock)"
20250204,YukiMatsuri2025,JA-JP,6765872006,"今日からさっぽろ雪まつり","犬山城の大雪像, 北海道 札幌市 (© Randy Green/Alamy Stock Photo)"
20250205,ScottishSheep,JA-JP,7061956700,"黒い顔の羊","ブラックフェース, スコットランド  (© Mike Powles/Getty Images)"
20250206,WhararikiBeach,JA-JP,9113396067,"今日はワイタンギ・デー","アーチウェイ諸島, ニュージーランド (© Francesco Vaninetti/AWL/plainpicture)"
20250207,BlueNorway,JA-JP,1977029810,"濃い青色に染まる街","トロンハイム, ノルウェー (© Jeanny Mueller/Getty Images)"
20250208,SnowySvaneti,JA-JP,2274619860,"塔が立ち並ぶ町","メスティア, ジョージア スヴァネティ (© photoaliona/Getty Images)"
20250209,AlstromPoint,JA-JP,2498220831,"パウエル湖を望む絶景ポイント","アルストロムポイント, 米国ユタ州 (© T.M. Schultze/TANDEM Stills + Motion)"
20250210,UmbrellaDay,JA-JP,2687142465,"カラフルな傘が広がる「アンブレラスカイ」","バラマーケット, イギリス ロンドン (© Malcolm P Chapman/Getty Images)"
20250211,KairakuUme2025,JA-JP,3144342607,"今日から水戸の梅まつり","春の訪れを告げる梅の花, 茨城県 水戸市 (© dekitateyo/shutterstock)"
20250212,PolarBearSwim,JA-JP,3305613182,"今日はダーウィンの日","ホッキョクグマ  (© Ondrej Prosicky/Shutterstock)"
20250213,LakeTyrrell,JA-JP,3510337163,"雪のように白く輝く塩湖","ティレル湖, オーストラリア ビクトリア州 (© Monica Bertolazzi/Getty Images)"
20250214,PenguinLove,JA-JP,3730970592,"今日はバレンタインデー","マゼランペンギンのペア, イギリス (© Vicki Jauron, Babylon and Beyond Photography/Getty Images)"
20250215,Misotsuchi2025,JA-JP,3931043311,"ライトアップされた幻想的な氷柱","三十槌の氷柱, 埼玉県 秩父市 (© watayu0821/Shutterstock)"
20250216,HumpbackMother,JA-JP,4098515390,"今日は「ワールド・ホエール・デイ」","ザトウクジラの親子, トンガ (© Chase Dekker/Minden Pictures)"
20250217,YungangGrottoes,JA-JP,4266553262,"岩壁に彫られた巨大な仏像","雲崗石窟, 中国 山西省 (© Eric Yang/Getty Images)"
20250218,BlueBelize,JA-JP,4446467431,"カリブ海の宝石","グレート・ブルーホール, ベリーズ (© JamiesOnAMission/Shutterstock)"
20250219,IceHoleOtter,JA-JP,4600805047,"可愛い水中ダンサー","ユーラシアカワウソ, オランダ (© Ernst Dirksen/Minden Pictures)"
20250220,FestungKonigsteinElbsandsteingebirge,JA-JP,4771104579,"台形の山上にそびえる要塞","ケーニッヒシュタイン要塞, ドイツ (© Bildagentur-online/Exss/Alamy)"
20250221,ChampakaSarasi,JA-JP,0008600806,"魅力的な古代の水槽","チャンパカ・サラシール, インド カルナータカ州 (© Amith Nag Photography/Getty Images)"
20250222,StLouisArch,JA-JP,0218152600,"西部開拓の記念モニュメント","ゲートウェイ・アーチ, 米国 ミズーリ州 (© f11photo/Getty Images)"
20250223,MtFujiSunrise,JA-JP,0451320828,"今日は「富士山の日」","河口湖からの富士山, 山梨県 南都留郡 (© Twenty47studio/Getty Images)"
20250224,RibbleheadViaduct,JA-JP,0769503543,"歴史的な鉄道橋","リブルヘッド高架橋, イングランド ノース・ヨークシャー (© AWL Images/DanitaDelimont.com)"
20250225,BryceHoodoos,JA-JP,0914701137,"無数の土柱が並ぶ絶景","ブライスキャニオン国立公園, 米国 ユタ州 (© Stephen Matera/TANDEM Stills + Motion)"
20250226,ArgyllStalker,JA-JP,1121064297,"海の小島に佇む中世のお城","ストーカー城, スコットランド (© WLDavies/Getty Images)"
20250227,PolarCub,JA-JP,1257956041,"今日は国際ホッキョクグマの日","雪の中のホッキョクグマの子, カナダ マニトバ州 (© Eric Baccega/NPL/Minden Pictures)"
20250228,BhutanMonastery,JA-JP,1458270567,"今日はチベットの正月「ロサル」","タクツァン僧院, ブータン (© Baron Reznik/Getty Images)"
20250301,EucalyptusForest,JA-JP,1746182669,"ユーカリの木が織りなす絶景","ブルー・マウンテンズ国立公園, オーストラリア ニューサウスウェールズ州 (© Andrew Peacock/TANDEM Stills + Motion)"
20250302,HornbillPair,JA-JP,1960738768,"明日は世界野生生物の日","ミナミキバシコサイチョウ, 南アフリカ (© Richard Du Toit/Minden Pictures)"
20250303,Hinamatsuri2025,JA-JP,2146557406,"今日はひな祭り","かぐやびな, 兵庫県 上郡町 (© Buddhika Weerasinghe/特派員/Getty Images)"
20250304,MardiGrasJackson,JA-JP,2336854900,"今日はマルディグラ","ジャクソン・スクウェア, 米国 ルイジアナ州 (© SeanPavonePhoto/Getty Images)"
20250305,SuratThani,JA-JP,0039497594,"美しい熱帯雨林に囲まれた青い湖","カオソック国立公園, タイ (© Peetatham Kongkapech/Getty Images)"
20250306,NevadaBigHorns,JA-JP,0367669044,"岩の上に立つ砂漠オオツノヒツジ","バレー・オブ・ファイヤー州立公園, 米国 ネバダ州 (© Rachid Dahnoun/Cavan Images)"
20250307,PlumBlossom,JA-JP,3242294823,"寒さの中に凛とした姿で咲く花","梅の花, 中国 (© zhikun sun/Getty Images)"
20250308,FearlessWomen,JA-JP,3446140149,"今日は国際女性デー","恐れを知らぬ少女, 米国 ニューヨーク州 (© JOHANNES EISELE/AFP via Getty Images)"
20250309,ItalyClock,JA-JP,3693788365,"米国では今日から夏時間","サン・マルコ時計塔, イタリア (© scaliger/Getty Images)"
20250310,PandaSnow,JA-JP,3991253092,"明日はパンダ発見の日","パンダの赤ちゃん, 中国 (© Cheryl Schneider/Alamy)"
20250311,TohokuEarthquake2025,JA-JP,8965651144,"東日本大震災から 14 年","追悼イベントの灯籠, 宮城県 名取市 (© Kuni Takahashi/寄稿者/Getty Images)"
20250312,Omizutori2025,JA-JP,2990990687,"今日は東大寺のお水取り","東大寺, 奈良県 奈良市 (© Chris Willson/Alamy Stock Photo)"
20250313,HoliColors,JA-JP,6070846521,"今日はホーリー祭","カラフルな色粉を投げ合う祭り, インド (© powerofforever/Getty Images)"
