Enddate,Name,Region,ID,Headline,Copyright
20240430,CheetahRain,PT-BR,5107827451,"Velozes e Peludos","Guepardo na chuva da manhã, Planícies de Ndutu, Área de Conservação de Ngorongoro, Tanzânia (© Paul Souders/Getty Images)"
20240501,DiadaLiteraturaBrasileira,PT-BR,6259851380,"Um destino literário","Real Gabinete Portugues de Leitura, Rio de Janeiro (© Wagner Meier/Getty Images)"
20240502,CratersOfTheMoon,PT-BR,6520589652,"Destino Lunar dos Terrestres!","Fluxo de lava Dragão Azul, Monumento e Reserva Nacional Crateras da Lua, Idaho, EUA (© Alan Majchrowicz/Getty Images)"
20240503,DiadoSertanejo,PT-BR,9682293877,"Ando devagar porque já tive pressa...","Colorido atardecer en Pantanal, Brasil (© filipefrazao/Getty Images)"
20240504,JediMonastery,PT-BR,8049739935,"A celebração galáctica","As ruínas de um antigo mosteiro na ilha de Skellig Michael, Irlanda (© MNStudio/Getty Images)"
20240505,SanMiguelAllende,PT-BR,8483156225,"Encante-se com San Miguel de Allende!","Colunata em San Miguel de Allende, Guanajuato, México (© Mint Images/Getty Images)"
20240506,RiverNekarHeidelberg,PT-BR,6227220024,"Vista de cartão postal","Heidelberg, no rio Neckar, em Baden-Württemberg, Alemanha (© Juergen Sack/Getty Images)"
20240508,PortMarseille,PT-BR,3194394496,"海港景色","伊夫堡，马赛，法国 (© Sergii Figurnyi/Alamy)"
20240508,IguazuTurism,PT-BR,9760109650,"Tesouros nacionais","Cataratas do Iguaçu durante o amanhecer (© SinghaphanAllB/Moment/Getty Images)"
20240509,EmirganPark,PT-BR,9433604698,"Tulipas em tons vibrantes","Tulipas no Emirgan Park em Istambul, Turquia (© Ozbalci/Getty Images)"
20240510,MisoolRajaAmpat,PT-BR,6517717174,"A magia da ilha","Misool, Ilhas Raja Ampat, Indonésia (© Giordano Cipriani/Getty Images)"
20240511,TexasIndigoBunting,PT-BR,6730881258,"O voo da esperança","Um azulão empoleirado em um galho, Texas, Estados Unidos (© Jeff R Clow/Getty Images)"
20240512,GuanacoMother,PT-BR,7069142219,"A beleza serena","Fêmea de guanaco e bebê recém-nascido em pastagem, província de La Pampa, Argentina (© Gabriel Rojo/Minden Pictures)"
20240513,NamibiaCanyon,PT-BR,7314875835,"Horizontes profundos","Desfiladeiro do rio Fish, Namíbia (© R. M. Nunes/Getty Images)"
20240514,CarlsbadNP,PT-BR,7544935694,"Maravilhas subterrâneas","Trilha que leva ao Big Room, Grutas de Carlsbad, Novo México (© Doug Meek/Getty Images)"
20240515,BlueCityIndia,PT-BR,7765486791,"A magia da Cidade Azul","A Cidade Azul de Jodhpur, Índia (© cinoby/Getty Images)"
20240516,DayOfLight,PT-BR,7977320546,"Iluminando o caminho","'Feelings are Facts' (Sentimentos são fatos), do artista Olafur Eliasson e do arquiteto Ma Yansong, Pequim, China (© Feng Li/Getty Images News)"
20240517,TarangireElephants,PT-BR,9979896896,"Aventuras de grande porte!","Uma família de elefantes africanos no Parque Nacional Tarangire, Tanzânia (© Vicki Jauron, Babylon and Beyond Photography/Getty Images)"
20240518,MuseumWhale,PT-BR,0044062488,"Uma longa história","Esqueleto de baleia azul chamada Hope, Museu de História Natural, Londres, Inglaterra (© Bailey-Cooper Photography/Alamy Stock Photo)"
20240519,VernazzaItaly,PT-BR,0108995686,"Onde a história encontra o mar","Vila de Vernazza, Cinque Terre, Ligúria, Itália (© Roberto Moiola/Sysaworld/Getty Images)"
20240520,HoneycombBee,PT-BR,0168442685,"A dança das abelhas","Abelha cuidando do favo de mel (© Simun Ascic/Alamy Stock Photo)"
20240521,MalaysiaTea,PT-BR,0222561765,"Aconchego em uma xícara","Plantação de chá de Cameron Highlands, Malásia (© alex cheong/Getty Images)"
20240522,SnowGumTasmania,PT-BR,0279882424,"Mergulhe na diversidade","Eucalipto goma-da-neve-da-Tasmânia (Eucalyptus pauciflora), Parque Nacional Mount Field, Tasmânia, Austrália (© Ignacio Palacios/Getty Images)"
20240523,IndianStarTortoise,PT-BR,0334099944,"Devagar e sempre!","Tartaruga-estrelada-indiana, Sri Lanka (© Robin Chittenden/Minden Pictures)"
20240524,DiaNacionaldoCafe,PT-BR,0388353116,"Vai um cafézinho?","Um trabalhador peneira grãos de café na fazenda de café Camocim em Domingos Martins, Espírito Santo (© Carl de Souza/Getty Images)"
20240525,MoroccoBenhaddou,PT-BR,0472580311,"Guardiões das dunas","Aït Benhaddou, Marrocos (© Grant Faint/Getty Images)"
20240526,MethowWildflowers,PT-BR,0540541576,"Selvagens e livres","Bálsamos e lupinos, Methow Valley, North Cascades, Washington, EUA (© Alan Majchrowicz/Getty Images)"
20240527,MataAtlantica,PT-BR,0600772527,"Além do horizonte","Parque Nacional Serra dos Órgãos em Petrópolis, Río de Janeiro (© MesquitaFMS/Getty Images)"
20240528,MeteoraMonastery,PT-BR,0665856775,"No topo do mundo","Mosteiro de Roussanou, Meteora, Tessália, Grécia (© Marius Roman/Getty Images)"
20240529,MullOtter,PT-BR,0721243704,"A vida na água","Lontras européias adolescentes, Loch Spelve, Ilha de Mull, Escócia (© Neil Henderson/Alamy Stock Photo)"
20240530,Everglades90th,PT-BR,0782569600,"Paraíso da vida selvagem","Uma área de pinheiros e pradaria de grama, Parque Nacional de Everglades, Flórida, EUA (© Jonathan Gewirtz/Tandem Stills + Motion)"
20240531,YorkshireDalesNP,PT-BR,5805097424,"Uma terra verde e agradável","Gunnerside, Swaledale, Parque Nacional de Yorkshire Dales, Inglaterra (© Derek Croucher/Alamy Stock Photo)"
20240601,PrideMonthSF,PT-BR,6281938141,"Orgulho, sem prejuízo","Centro Cívico de São Francisco iluminado com luzes de arco-íris para Orgulho LGBTQIA+, Califórnia, EUA (© Josh Edelson/AFP via Getty Images)"
20240602,CopenhagenBicycles,PT-BR,5476760078,"Uma pedalada de cada vez","Bicicletas em Copenhague, Dinamarca (© Alphotographic/Getty Images)"
20240603,CapybaraEducation,PT-BR,9998060500,"Vivendo em harmonia","Capivara, o maior roedor do mundo, na margem de um rio no Pantanal (© Joe McDonald/Getty Images)"
20240604,ChestnutBeeEater,PT-BR,6524596779,"Vermelho, amarelo, azul... Muitas cores!","Abelharuco-de-cabeça-castanha, Parque Nacional de Bardia, Nepal (© PACO COMO/Shutterstock)"
20240605,MadagascarRiver,PT-BR,7232388819,"Juntos pela saúde do nosso planeta","Parque Nacional de Masoala, em Madagascar (© Dennis van de Water/Shutterstock)"
20491231,/sa/simg/hpb/LaDigue,PT-BR,1115245085,"","La Digue, an island in the Seychelles (© Oleksandr Dibrova/Adobe Stock)"
20240607,HumpbackFamily,PT-BR,7707157719,"Ondas de esperança","Família de baleias jubarte, Dutch Harbor, Alasca, EUA (© Jude Newkirk/Amazing Aerial Agency)"
20240608,KillikRiverAlaska,PT-BR,9004579454,"O encontro das águas","Confluência de Easter Creek e Killik River, Parque Nacional e Reserva Portas do Ártico, Alasca, EUA (© Patrick J. Endres/Getty Images)"
20240609,BardenasBiosphere,PT-BR,8155922865,"Natureza de tirar o fôlego","Reserva da Biosfera e Parque Natural Bardenas Reales, Bardenas, Navarra, Espanha (© Aliaume Chapelle/Tandem Stills + Motion)"
20240610,OsakaNight,PT-BR,8462311640,"Cidade dos sonhos em neon","Osaka à noite, Japão (© wichianduangsri/Getty Images)"
20240611,GemsbokBotswana,PT-BR,8699513531,"Esses antílopes são verdadeiras joias","Órix-do-cabo na savana, Botsuana (© Karine Aigner/Tandem Stills + Motion)"
20240612,DiadosNamorado,PT-BR,1152869085,"Eu sei que vou te amaaaaar","Periquito-monge e do periquito-da-planície cuidando um do outro (© diegograndi/Getty Images)"
20240613,RegistanUzbekistan,PT-BR,8909125250,"Contos de azulejos","Fachada de mosaico na Praça Registan, Samarcanda, Uzbequistão (© da-kuk/Getty Images)"
20240614,PeggysCove,PT-BR,1473312250,"Sozinho, mas nunca solitário","Farol de Peggys Cove, Nova Escócia, Canadá (© Pugalenthi/Getty Images)"
20240615,NazareWave,PT-BR,1726789452,"Na crista da onda","Surfista pegando onda em Nazaré, Portugal (© Rui Caria/Getty Images)"
20240616,FloresIsland,PT-BR,1096612620,"As vistas o deixarão maravilhado","Lagos de crateras vulcânicas em Kelimutu, Flores, Indonésia (© Shane P. White/Minden Pictures)"
20240617,HummingThistle,PT-BR,2010044953,"Abra suas asas","Beija-flor brilhante de coroa verde com cardo gigante, Cerro de la Muerte, Costa Rica (© adrian hepworth/Alamy Stock Photo)"
20240618,LupinIceland,PT-BR,2281677682,"Florescendo para a vida","Campos de tremoços e igreja ao nascer do sol, Península de Snæfellsnes, Islândia (© Matteo Colombo/Getty Images)"
20240619,CuxhavenTower,PT-BR,2536351203,"Um monumento histórico","Torre de água em Cuxhaven, Alemanha (© Andreas Vogel/Alamy)"
20240620,KokinoMacedonia,PT-BR,2816851215,"Revelando o conhecimento astronômico","Kokino, um antigo observatório megalítico, Macedônia do Norte (© stoimilov/Shutterstock)"
20240621,IniciodoInverno,PT-BR,1929239619,"O inverno começou","Pôr do sol na praia de Ipanema, Rio de Janeiro, Brasil. Vista para as praias de Ipanema e Leblon, Morro Dois Irmãos e Pedra da Gávea (© Anton Petrus/Getty Images)"
20240622,BrazilRainforest,PT-BR,3213724204,"Perder-se na névoa","Floresta Amazônica, Brasil (© Claus Meyer/plainpicture)"
20240623,DhakaBangladesh,PT-BR,3551380225,"Noite escura, luzes da cidade","Vista aérea de uma rotatória em Daca, Bangladesh (© Azim Khan Ronnie/Amazing Aerial Agency)"
20240624,FestasJuninas,PT-BR,2004376750,"Olha a cobra!","Rua em Salvador decorada com bandeiras coloridas entre prédios (© Henn Photography/Aurora Photos/Getty Images)"
20240625,FireWave,PT-BR,3949258525,"Lugar perfeito para uma foto legal","Formação rochosa Onda do Fogo, Parque Estadual Vale do Fogo, Nevada, EUA (© Clint Losee/Tandem Stills + Motion)"
20240626,CardinalfishAnemone,PT-BR,4236573966,"Espetaculares listras!","Peixe Cardinal Bangai juvenil com anêmona do mar, Estreito de Lembeh, Sulawesi do Norte, Indonésia (© Constantinos Petrinos/NPL/Minden Pictures)"
20240627,FlorenceDuomo,PT-BR,4528036954,"Colosso florentino!","Catedral Santa Maria del Fiore ao anoitecer, Florença, Itália (© Elena Pueyo/Getty Images)"
20240628,Pride2024,PT-BR,0771293980,"Dia de celebrar a diversidade","Foliões enchem as ruas segurando uma bandeira gigante do arco-íris durante a parada anual do orgulho LGBT na avenida Paulista (© Nelson Antoine/Shutterstock)"
20240629,TourCorsica,PT-BR,5751262525,"Hora de vencer a corrida","Ciclistas no Volta a França de 2013, Córsega, França (© Pascal Pochard-Casabianca/AFP via Getty Images)"
20240630,UbudBali,PT-BR,6634868084,"O coração cultural de Bali","Escultura em pedra em um templo em Ubud, Bali, Indonésia (© R. Schönebaum/plainpicture)"
20240701,FisgardLighthouse,PT-BR,7039409660,"Surpreenda-se com o Canadá","Farol de Fisgard, porto de Esquimalt, Colwood, Colúmbia Britânica, Canadá (© davemantel/Getty Images)"
20240702,ItalicaRuins,PT-BR,7394410327,"Fantasmas de cidades passadas","Italica, uma antiga cidade romana em Santiponce, Sevilha, Andaluzia, Espanha (© Moses Palermo/Amazing Aerial Agency)"
20240703,MeerkatManor,PT-BR,7654628186,"Espere! Quem está aí?","Família dos suricatos (© anetapics/Shutterstock)"
20240704,ZaharaDeLaSierra,PT-BR,7910795678,"Uma pitoresca vila branca","Zahara de la Sierra, Andaluzia, Espanha (© Francesco Carovillano/eStock Photo)"
20240705,NoahBeach,PT-BR,8215908491,"Um encontro na costa","Praia de Noah na floresta tropical de Daintree, Queensland, Austrália (© bjeayes/Getty Images)"
20240706,ConwyRiver,PT-BR,8493712176,"Navegue com estilo","Castelo de Conwy com vista para o rio Conwy, País de Gales (© David Chapman/Alamy Stock Photo)"
20240707,YenBaiTerraces,PT-BR,8757811796,"Um paraíso de terraços","Terraços de arroz de Mù Cang Chải, província de Yên Bái, Vietnã (© Kiatanan Sugsompian/Getty Images)"
