Enddate,Name,Region,ID,Headline,Copyright
20240101,SleepingFox,ZH-CN,2622967726,"新年伊始","睡在雪地里的赤狐，阿布鲁佐，意大利 (© marco vancini/500px/Getty Images)"
20240101,Sunrise2024,JA-JP,1927003758,"今日は元日","本栖湖から見る富士山の日の出, 山梨県 (© Sakarin Sawasdinaka/Shutterstock)"
20231231,ReveillonBrazil,PT-BR,9820187694,"Até o próximo ano!","Fogos de artifício na festa de Ano Novo na praia de Copacabana (© Pulsar Imagens/Alamy)"
20240102,MehrangarhJodhpur,ZH-CN,2855490711,"百年城堡","贾斯旺萨达陵墓和梅兰加尔古堡，焦特布尔，拉贾斯坦邦，印度 (© Twenty47studio/Getty images)"
20240102,BhutanSolstice,EN-GB,3360165069,"Make your own rainbow","Prayer flags in Phobjikha Valley, Bhutan (© John Warburton-Lee/DanitaDelimont.com)"
20240103,BodleianCeiling,EN-GB,7979385278,"One library to rule them all","Bodleian Library, University of Oxford, England (© Andrew Holt/Getty Images)"
20240103,VirupakshaTempleIN,EN-IN,4741302858,"A celestial saga","Virupaksha temple in the ancient city of Vijayanagar at Hampi, Karnataka, India. (© leshiy985/shutterstock)"
20240103,Cheserys,FR-FR,0495311297,"Un panorama unique sur le Mont-Blanc","Coucher de soleil sur les lacs des Chéserys, Chamonix-Mont Blanc, France (© Smit/Shutterstock)"
